course_id,course_title,content_duration
459207,Master the Bassoon - Intermediate Instruction Made Simple!,7.5
628786,Adobe Illustrator Advanced Vector Artwork,7.5
371896,Learn to Play Trombone: Go From Beginner to Pro in No Time!,7.5
674040,Bootstrap Tutorial - Essentials From Basic to Advanced,7.5
866384,Advanced WordPress Topics: Post Types Taxonomies & Metaboxes,7.5
650222,The Complete HTML5 and CSS3 Course - with 8 Websites Design,7.5
978850,Learn by Example : ReactJS,7.5
399938,Professional Logo Design in Adobe Illustrator,7.5
1123098,RxJs & Reactive Programming Angular Masterclass - Angular 4,7.5
113706,Build Flat Responsive Website from Scratch - Complete Course,7.5
26845,Advanced HTML5 Tutorial for Web Developers,7.5
927442,Learn the Foundations of Stocks and Options,7.5
143028,Code a Responsive Website Using HTML5 and CSS for Beginners,7.5
641868,The Docker for DevOps course: From development to production,7.5
179446,Commercial Credit Analysis,7.5
172906,Practical Font Design,7.5
886300,Accelerated JavaScript Training,7.5
556248,The Complete HTML & CSS Course - From Novice To Professional,7.5
305368,NPV and IRR Techniques for CA / CFA / CPA Exams,7.5
615226,"Play Leyenda, Canarios, and Bach on Classical Guitar",7.5
231970,Drawing Perspective For Beginners,7.5
856950,Euphonium Pro Series - Fall in love with the Euphonium,7.5
100526,Winning Options Trading System,7.5
793246,Autodesk Inventor 2016 : Complete Guide ,7.5
489114,The Complete Video Production Guide - Learn Top Video Tools,7.5
512000,WordPress Theme Academy with Bootstrap,7.5
65355,Web Development: Make A Website That Will Sell For Thousands,7.5
519952,PHP: Complete Login and Registration System with PHP & MYSQL,7.5
701570,Build Real World Websites from Scratch using HTML5 and CSS3,7.5
42251,Blues and Advanced Guitar Lessons,7.5
922092,Photoshop para principiantes: ¡De cero a experto!,7.5
343818,Understanding The Stock Market: For Beginners,7.5
705444,Adobe Photoshop CC - Fundamentos,7.5
961684,Mastering Logo Design - 20 Projects step-by-step,7.5
202290,Stock Market Mastery,7.5
859936,WordPress Academy: Learn WordPress step by step,7.5
1163242,Profit and Loss Account for bankers and credit analysts,7.5
321410,Beginner to Pro in Excel: Financial Modeling and Valuation,7.5
65105,Professional Risk Manager (PRM) Certification: Level 2,7.5
1046724,Quantitative Trading Analysis with R,7.5
595876,Logo Design in Adobe Illustrator - for Beginners & Beyond,7.5
948204,Web Building Starter Pack. Html Css and JQuery Animations,7.5
986406,Typescript Masterclass & FREE E-Book,7.5
806922,The Complete ASP.NET MVC 5 Course,7.5
1031626,Bootstrap 4 Responsive Web Design and Development,7.5
871682,Aprenda  a Investir,8.0
140368,Adobe Illustrator CC for beginners,8.0
813142,Horn Pro Series - You're going to love playing French Horn,8.0
1142202,Master Angular 4 by Example - Build 7 Awesome Apps!,8.0
470482,"Master the Euphonium with Simple, Intermediate Instruction!",8.0
292462,Learn to Raise the Funds You Need via Crowdfunding,8.0
787236,"Build Responsive Website Using HTML5, CSS3, JS And Bootstrap",8.0
1016388,Projects In ReactJS - The Complete React Learning Course,8.0
1208638,"React JS, Angular & Vue JS - Quickstart & Comparison",8.0
152244,Responsive Web Design with HTML5 and CSS3 - Introduction,8.0
467426,Become a Certified Web Developer - Beginner to Expert,8.0
866528,Advanced Trombone Studies - Learn to Master the Trombone!,8.0
1241254,AWS Serverless APIs & Apps - A Complete Introduction,8.0
1112604,Javascript Specialist,8.0
904818,Web Security: Common Vulnerabilities And Their Mitigation,8.0
546124,Drawing Anime & Manga Style,8.0
56513,Social Network Web Development,8.0
980408,Introduction to the economics of public services regulation,8.0
835082,Corel Painter 2016,8.0
862478,"Build Your Startup with No Coding (Design, Develop & Ship)",8.0
585566,Master Adobe Photoshop Lightroom CC - From Beginner to Advan,8.0
80940,Build Websites from Scratch with HTML & CSS,8.0
65113,Professional Risk Manager (PRM) Certification: Level 4,8.0
214328,Piano Lessons for the R&B Fan,8.0
349586,Master Manga Studio 5: Bonus Drawing and Painting,8.0
815482,Stock Technical Analysis with Python,8.0
18448,Learning CSS3 - A Comprehensive Tutorial For Web Developers,8.0
1211800,Wordpress Theme Development for Beginners,8.0
797762,Corporate Finance 101: Financial Statement Analysis & Ratios,8.0
749542,Graphic Design Bootcamp,8.0
1009166,Lerning PHP by building website,8.0
842058,Build A Web App With Spring Framework and Angular 2,8.0
885479,Become a Professional Logo Designer,8.0
397946,Easy Steps To Become A Photoshop Expert,8.0
283038,Adobe Illustrator CS6 باللغة العربية,8.0
1107904,Financial Reporting A Comprehensive Study,8.0
263818,Learn to Play French Horn: Beginner to Pro Made the Easy Way,8.0
1200530,Electron for Desktop Apps: The Complete Developer's Guide,8.0
49798,Bitcoin or How I Learned to Stop Worrying and Love Crypto,8.0
492818,Professional WordPress Theme Development For 2017,8.0
176136,Trade for a Living,8.0
713098,Build an Amazon clone: Nodejs + MongoDB + Stripe Payment,8.5
1193288,Accounting Simplified,8.5
1009236,Web Development With Google Maps,8.5
1036028,Build Wordpress CMS Clone with Laravel 5,8.5
413713,A Complete Guide to Successful Freelance Logo Design Career,8.5
855172,Hedge and Mutual Fund Careers: The Complete Guide,8.5
1227792,Contabilità Generale,8.5
1210652,HTML5 and CSS3: Learn Web Design with HTML + CSS + Bootstrap,8.5
459888,Master the Tuba - Intermediate Instruction Made Simple!,8.5
194692,Quicklessons Piano Course - Learn to Play Piano by Ear!,8.5
66383,A Beginners Guide to Technical Analysis of Stock Charts,8.5
1045942,Angular NgRx Store Masterclass - Covers Angular 4,8.5
937150,How to Invest in Startups - Expert Reveals Winning Secrets.,8.5
1277924,Angular 4 Front To Back,8.5
917724,Learn JavaScript for Web Development,8.5
794036,8 Stunden professionelles Cinema 4D Training,8.5
595728,Complete HTML5 and CSS3 Course +1 Start to Finish Project,8.5
174790,Accounting 102: Guide to Business Accounting,8.5
326326,SharePoint 2013 Development using C# - Part I,8.5
315716,15 Mandamientos para ganar dinero en Bolsa,8.5
116924,Gana en la Bolsa con Análisis Técnico,8.5
833442,Angular (Angular 2 or 4) & NodeJS - The MEAN Stack Guide,8.5
707962,Javascript Essentials,8.5
1189592,Learn How To Successfully Trade Forex: In 5 Simple Steps,8.5
968268,Photoshop: Organización de eventos y decoración de fiestas,8.5
106178,Become a Heroku Rails Ninja: Expert Level Deployment Tools,8.5
1049092,React JS - Build real world JS apps & deploy on cloud,8.5
392958,Learn To Play The Drums,8.5
1216164,Photoshop - Automatização com Adobe Script,8.5
860812,JavaScript the Basics - JavaScript for Beginners,9.0
246154,Web Design for Beginners: Real World Coding in HTML & CSS,9.0
429952,The Complete Financial Model Builder Course-Build 7 Models,9.0
765562,"Comprehensive Guide to Financial Markets, Investing &Trading",9.0
665866,Investment Portfolio Analysis with Excel,9.0
599652,48 Logo Designs and Techniques,9.0
130168,HTML and CSS for Beginning Web Developers,9.0
1019276,The Ultimate Beginner's Guide to Django,9.0
767656,Bootstrap Essential Training - Create Your Very Own Website,9.0
221306,Accounting Is Easy (for Beginners),9.0
1062686,Complete RESPONSIVE Website Design with HTML5 & CSS3,9.0
881210,Learn Complete WordPress for Building a Professional Sites,9.0
1047436,How to Draw and Sketch for Beginners,9.0
1004134,Angular 2 + Rails 5 Bootcamp,9.0
804096,Curso Completo de SolidWorks 2016.,9.0
373636,Master the Trombone: Intermediate Instruction Made Simple!,9.0
832862,Meteor and React for Realtime Apps,9.0
1119092,"Learn guitar the Right way! Complete 'KickStarter course""",9.0
1071060,Django by Example,9.0
1046992,Forex & Financial Market Trading Tutorial- Online Strategies,9.0
328476,Complete ASP NET MVC Web Development - Newbie to Ninja!,9.0
389240,How to Make a Website Without Coding- WordPress & Web Skills,9.0
1247828,Angular 4 (2+) Crash Course for Beginners,9.0
1169378,Build a complete Fiverr clone with Node + Algolia + Paypal,9.0
576694,Ultimate WordPress Plugin Course,9.0
720144,Basic HTML CSS and Web Design,9.0
1035923,ASP.NET MVC 5 Project - CMS and Shopping Cart with Paypal,9.0
318638,Projects In JavaScript & JQuery,9.0
1092632,The Complete Motion Graphic Course,9.5
719002,Angular 2 with TypeScript for Beginners: The Pragmatic Guide,9.5
846412,Learning Drupal 8,9.5
975916,17 Complete JavaScript   projects explained step by step,9.5
1193538,HTML5 And CSS3 - Build Modern Responsive Websites,9.5
1055322,Learn Laravel PHP Framework Building Multi User SEO Blog APP,9.5
456284,The Professional Guitar Masterclass,9.5
1147458,Complete Trading Plan Course for Stocks & Forex (10 Hours),9.5
766320,สร้างงานกราฟฟิคแอพพลิเคชั่นมือถือด้วย Adobe Illustrator,9.5
632702,Adobe Suite : Unleash your creativity & benefit from it !,9.5
30318,Learning JavaScript Programming Tutorial. A Definitive Guide,9.5
769390,Angular 2 Master Class with Alejandro Rangel,9.5
26648,Play Guitar and Understand Music Quick & Easy in 28 Days!,9.5
382204,Learn How To Successfully Trade Stocks: In 5 Simple Steps,9.5
1022032,Adobe Illustrator CC,9.5
1009452,Build Enterprise Applications with Angular 2 (and Angular 4),9.5
987666,Learn React : The World's Most Lucrative JavaScript Library,9.5
40039,Comprehensive Forex Mastery Program,10.0
919354,Learn Bootstrap 4 The Most Popular HTML5 CSS3 & JS Framework,10.0
420926,CFA® Level 1 2014 – Financial Reporting and Analysis,10.0
822926,Curso de Trading práctico basado en casos reales,10.0
1136912,Financial Accounting - The Ultimate Beginner Course,10.0
593962,Stock Fundamental Analysis with Excel,10.0
24877,Introductory Financial Accounting,10.0
399228,"Learn to code, Become a Web Developer and Master JavaScript!",10.0
164554,AngularJS JumpStart with Dan Wahlin,10.0
897146,"Become a Full Stack Developer with Spring, AWS and Stripe",10.0
23742,Servlets and JSPs Tutorial: Learn Web Applications With Java,10.0
564268,Projects in Foundation Framework - Learn By Building 10 Apps,10.0
950894,photoshop - CURSO DE PHOTOSHOP DO BÁSICO AO AVANÇADO,10.0
856526,The Build a SAAS App with Flask Course,10.0
1170198,Beginner Guitar Lessons: Learn To Play Guitar Today (WAVE 1),10.0
1053272,The Financial Analyst Skills Training (FAST) course 2017,10.0
648826,The Complete Financial Analyst Course 2017,10.0
949282,Learn Angular 2 from Beginner to Advanced,10.0
303514,Projects in CSS,10.0
954710,HTML/CSS Bootcamp,10.0
434774,Options Trading Stocks: Proven Toolbox For Financial Success,10.0
998580,Mobile App Design: From Beginner to Intermediate,10.0
15611,Discover the 7 Secrets to Figure Drawing: Draw Awesome ...,10.0
403468,Financial Accounting: The Complete Introductory Crash Course,10.0
41295,Learn HTML5 Programming From Scratch,10.5
173776,Ultimate Blues Guitar Beginner Lessons,10.5
1260288,"Master JavaScript Programming, 3 Projects Included !!",10.5
868128,Análise de Concessão de Crédito,10.5
1144726,Build a Real-world App with ASP.NET Core and Angular 2 (4+),10.5
495678,JavaScript for beginners - A Complete Guide,10.5
282050,The Day Trader: Learn to Trade The Stock Market and Forex,10.5
578534,The Intelligent Investor,10.5
506164,Mastering Photoshop Elements 13 Made Easy Training Tutorial,10.5
780150,Learning Photoshop CC 2015,10.5
655198,Siemens NX Unigraphics (UG) Basic to Advance 3D Modelling,10.5
56259,jQuery UI In Depth,10.5
207440,Super-Curso de Guitarra Práctico Para Principiantes,10.5
593544,PHP MVC Framework CodeIgniter Tutorial for Beginners Project,10.5
41890,Beginners Guide to Playing Guitar - Step-by-step System,10.5
297044,Learn WCF And Web APIs From Scratch,10.5
1032864,Learn to Read & Write Music to play Piano & more instruments,10.5
1076424,The Ultimate Guide to the Best WordPress Plugins Part 1,10.5
511838,The Advanced Web Developer Course,10.5
644020,Curso de Iniciación al Trading,10.5
1250824,Projects in Laravel: Learn Laravel Building 10 Projects,10.5
671552,React and Flux Web Development for Beginners,11.0
938560,The Complete Ethical Hacking Course 2.0: Python & Kali Linux,11.0
1141708,Managerial Accounting - The Ultimate Beginner Course!,11.0
686764,Learn Plugin Development in WordPress By Building  Projects,11.0
1217948,Learn How To Become a Web Developer From Scratch,11.0
555122,jQuery in Action: Build 8 jQuery Projects,11.0
800148,Become a Rockstar Web Developer - Learn By Coding,11.0
519776,How to Build a Massive Stock Portfolio from Zero!,11.0
1002210,Popular JavaScript Framework:Learn The Language Of Angular 2,11.0
1029554,Formação em Design Gráfico com Corel Draw Versões X8 / 2017.,11.0
764042,ReactJS and Flux: Learn By Building 10 Projects,11.0
683606,The Ultimate WordPress Boot Camp: Build 7 Websites,11.0
501140,Illustrator CC para novatos: ¡desde cero hasta experto! ,11.0
874012,The Ultimate Drawing Course - Beginner to Advanced,11.0
231176,Learn To Build Beautiful HTML5 And CSS3 Websites In 1 Month,11.0
751230,Illustrator CC: Design and drawing from scratch to expert!,11.0
43319,Options Trading Basics (3-Course Bundle),11.0
316704,Introductory JavaScript Made Easy Training Tutorial,11.0
687466,The complete JavaScript developer: MEAN stack zero-to-hero,11.5
50587,HTML & CSS From Scratch in 30 Days,11.5
863954,Angular 2 From The Ground Up,11.5
302562,Introduction to Accounting: The Language of Business,11.5
850426,Photoshop CC MasterClass,11.5
364426,JavaScript: Understanding the Weird Parts,11.5
72644,Complete Claritas Investment Certificate,11.5
1132342,Ultimate Beginner Guitar Masterclass,11.5
1154754,Financial Modeling for Startups & Small Businesses,11.5
64585,Gospel Piano Essentials,11.5
1046722,Ultimate Photoshop Training: From Beginner to Pro,11.5
875194,Build Incredible Chatbots,11.5
1025026,Javascript - From Beginner to Pro-Build real world JS apps,11.5
505126,Discover Classical Guitar Level 2   ,11.5
845794,Advance JavaScript for Coders: Learn OOP in JavaScript,11.5
1134390,Complete React JS web developer with ES6 - Build 10 projects,12.0
11475,Become a Certified Web Developer,12.0
715516,Modern Web Development with Laravel 5.2 (PHP Framework),12.0
873296,Corel Draw X7 Eğitimi (Temelden İleri Seviyeye),12.0
781532,Advanced React and Redux,12.0
742392,Conviértete en un experto de photoshop cc naked series,12.0
405488,Photoshop para novatos:  ¡desde cero hasta experto!,12.0
906760,Corel Draw x7,12.0
883002,Learn Angular 2 Development By Building 12 Apps,12.0
437398,Build Responsive Real World Websites with HTML5 and CSS3,12.0
164102,CFP - Introduction to Financial Planning,12.0
406424,"Photoshop, Illustrator, InDesign & Graphic Design Principles",12.0
94428,Learn Complete Web Development From Scratch,12.0
621022,Projects in MongoDB - Learn MongoDB Building Projects,12.0
155344,Introduction to Bookkeeping (Accounting),12.0
1197206,Illustrator CC MasterClass,12.0
30240,The Ultimate Web Development Course,12.0
1250934,Display and analyze GIS data on the web with Leaflet.js,12.5
866796,Learn Blender 3D - The materials and texture course,12.5
1107524,The Complete NodeJS Course: Build a Full Business Rating App,12.5
130366,Trading: High-ROI Trading,12.5
341952,Mastering Photoshop: From Beginner to Industry Professional,12.5
19603,Learning Dynamic Website Design - PHP MySQL and JavaScript,12.5
836044,React From The Ground Up,12.5
1167536,Learn to Trade Forex - from Beginner to Professional,12.5
835346,jQuery UI Ultimate:Design Amazing Interfaces Using jQuery UI,12.5
870368,Photoshop from Zero to Hero ( Arabic ),12.5
65110,Professional Risk Manager (PRM) Certification: Level 3,12.5
970600,REST APIs with Flask and Python,12.5
1109150,RESTful API with Laravel 5.4: Definitive Guide,12.5
426196,JavaScript from Beginner to Expert,12.5
896858,The Complete WordPress Development & Customization Course,12.5
112314,Acoustic Blues Guitar Lessons,12.5
1185390,Como Produzir Ebook e Livros com Adobe Indesign CC e CS6,12.5
1242692,Photoshop Workflow - Manipulação de imagem para Publicidade,12.5
32908,Finance and Accounting for Startups,12.5
98066,Complete Website & CMS in PHP & MySQL From Scratch!,12.5
916902,The Complete E-Commerce Web Developer Course 5.0,12.5
101234,The Smart Option Trader,13.0
1109926,GraphQL with React: The Complete Developers Guide,13.0
1022582,The Ultimate Vue JS 2 Developers Course,13.0
45941,The CSS and CSS3 Crash Course,13.0
531360,BDD with Ruby on Rails using RSpec 3 and Capybara,13.0
461160,Learn and Understand NodeJS,13.0
814206,Learn By Example: PHP For Dynamic Websites,13.0
701468,Photoshopマスターコース　基礎から上級まで　ステップバイステップでPhotoshopのすべてを学ぼう,13.0
997750,ASP NET CORE - ANGULAR 2 E-Commerce App,13.0
994634,Mastering ASP.NET MVC 5 From Scratch Using C#,13.0
340362,Learn Ruby on Rails By Building Projects,13.0
773824,"Learn By Example: The Foundations of HTML, CSS & Javascript",13.0
571394,QuickBooks Online: Complete Guide & Certification tips,13.0
249934,Finance for Non Finance Executives,13.0
1202746,Curso Online de Adobe Illustrator CC e CS6,13.0
991094,"Build Modern Responsive Website With HTML5, CSS3 & Bootstrap",13.0
378464,Accounting for CA CPT Exams Part I,13.5
1004008,Introduction to web programming for GIS applications,13.5
427530,Learn  Bootstrap Development By Building 10 Projects,13.5
992114,"Build A Complete CRUD Application With PHP, MYSQL & JQUERY",13.5
1000574,The Complete Developers Guide to MongoDB,13.5
807874,"Modern JavaScript: Building Real-World, Real-Time Apps",13.5
554384,Spring Framework 4 (Java Enterprise JEE) with AngularJS,13.5
789670,Diseño Gráfico fácil y rápido.,13.5
1012096,Become A Full Stack Web Developer in 14 Days,13.5
431576,Building a Social Network in PHP & MySQL From Scratch,14.0
516790,HTML and CSS: A Guide to Web Design,14.0
1064104,"Laravel, the complete guide with real world projects",14.0
188418,Tape Reading: Learn how to read the tape for day trading,14.0
173462,Aprende a invertir y deja que tu dinero trabaje para ti,14.0
739090,The Complete Guide to JavaScript Development,14.0
1111630,Learn to play the piano or keyboard from scratch,14.0
855764,Advance Learning Tools Corel Draw Graphics Design,14.0
304490,A 13 Hour SQL Server 2014 /ASP.NET/CSS/C#/jQuery Course,14.0
599504,Advanced Scalable Python Web Development Using Flask,14.0
921474,The Complete DevOps Engineer Course 2.0 - Java & Kubernetes,14.0
904462,The Complete Elixir and Phoenix Bootcamp,14.5
364428,CFA Corporate Finance Level 1 (Part 1),14.5
252950,Chartered Financial Analyst (CFA) - Level 1 - FRA,14.5
745468,Building An E-Commerce Store Using Java Spring Framework,14.5
174800,Accounting 101: Guide to Business Accounting,14.5
531954,Projects in AngularJS - Learn by building 10 Projects,14.5
527952,PHP for Beginners: How to Build an E-Commerce Store,14.5
81064,Easy Forex and Futures Trading,14.5
937586,"Ruby on Rails 5 - BDD, RSpec and Capybara",14.5
368340,Professional Python Web Development Using Flask,14.5
1017568,The Complete PHP Bootcamp Course With Video Sharing Project,14.5
648350,Curso Blender 3D  do Básico ao Avançado ,14.5
565000,Learn MeteorJS By Building 10 Real World Projects,15.0
327666,Digital Art for Beginners,15.0
936504,The Complete HTML5 and CSS3 Course,15.0
818990,Git a Web Developer Job: Mastering the Modern Workflow,15.0
197836,Projects in HTML5,15.5
200598,"LEARN HARMONICA, amaze your friends and have fun - it's easy",15.5
606756,Projects in ExpressJS - Learn ExpressJs building 10 projects,15.5
929130,Angular 4: From Theory to Practice & FREE E-Book,15.5
459922,The Complete Web Developer Course - Build 20 Websites,15.5
32649,PHP & MySQL - Learn The Easy Way. Master PHP & MySQL Quickly,15.5
82778,All about NodeJS,15.5
1047968,Vue JS 2: From Beginner to Professional,15.5
481002,Learn Nodejs by building 12 projects,16.0
631128,Complete Python Web Course: Build 8 Python Web Apps,16.0
1147664,Photoshop CC Eğitim Seti (YENİ),16.0
565384,Introduction to Modern Programming with PHP,16.0
301442,Black Algo Trading: Build Your Trading Robot,16.0
442580,Master ASP . NET 4 from scratch,16.0
665042,8 Beautiful Ruby on Rails Apps in 30 Days & TDD - Immersive ,16.0
418386,Create a REAL Social Network like Facebook in PHP + MySQL,16.5
797040,Complete Guide to Front-End Web Development and Design,16.5
260756,The Essential Web Developer Course - Build 12 Websites,16.5
711592,Using Modern JavaScript Today,16.5
857162,Learn To Create WordPress Themes By Building 10 Projects,16.5
834114,Character Concept Design for Beginners,16.5
1115222,Learn and Understand React,16.5
400130,The Business Graphic Design with Photoshop & Illustrator,17.0
1038786,JavaScript from Beginner to Advanced,17.0
383204,The Professional Ruby on Rails Developer,17.0
740762,Learn Top Ten PHP FrameWorks By Building Projects,17.5
1006894,"React.js: Building Production Ready Apps, Start to Finish",17.5
851712,The Complete JavaScript Course: Build a Real-World Project,17.5
260066,Banking Credit Analysis Process (for Bankers),17.5
753940,Become a Bootstrap Expert: Build 20 Layouts!,17.5
267560,Learn E-Commerce Website in PHP & MySQL From Scratch!,17.5
1053462,Management Accounting A Complete Study,17.5
1219326,Diventa un professionista del Graphic Design,17.5
537878,CFA Corporate Finance Level 2,17.5
995016,Vue JS 2 - The Complete Guide (incl. Vue Router & Vuex),18.0
706670,FOREX : Learn Technical Analysis,18.0
473548,PHP OOP: Object Oriented Programming for beginners + Project,18.0
19332,The Original Complete Web Developer Course.,18.0
905850,The Complete front end web developer Bootcamp - 14 projects,18.5
420982,Learning 200 jQuery Functions with 800 Examples,18.5
369132,One-stop Ruby on Rails: Build Web Applications from Scratch,18.5
996612,High Probability Trading Across Any Market: Stocks & Forex,18.5
1072248,The All-In-One Web Development Course,18.5
1009254,"Beginner API development in Node, Express, ES6, & MongoDB",18.5
993754,Django Core | A Reference Guide to Core Django Concepts,18.5
812914,Beginner Guitar Lessons - Your Complete Foundation Course,18.5
1002030,Web Development w/ Google’s Go (golang) Programming Language,19.0
382258,Ruby on Rails 4---A Test-Driven Approach,19.0
912946,Professional Rails Code Along,19.0
997814,Angular 2 & TypeScript Beginner Web Development,19.5
1171966,The Complete PHP MySQL Professional Course with 5 Projects,19.5
576054,"WordPress Development - Themes, Plugins & Single Page Apps",19.5
369662,Running a Web Development Business: The Complete Guide,19.5
907716,International Tax  - Tax Beyond boundaries,19.5
965528,Web Development Masterclass - Complete Certificate Course,19.5
521342,Succeed in Forex Even if You Don't Know Where to Start!,19.5
1070976,"Complete E-Commerce Course - Java,Spring,Hibernate and MySQL",20.0
580466,Complete PHP Course With Bootstrap3 CMS System & Admin Panel,20.0
117004,How to Draw Pinups and Sexy Women,20.0
730414,"Intro to Investment Banking, M&A, IPO, Modeling + Free Book",20.0
76052,Try Django 1.9 | Build a Blog and Learn Python's #1 Library,20.0
666254,Curso Avanzado de Trading,20.5
520116,The Complete WordPress Website Business Course,20.5
1185936,الدروس التعليمية لسوق الفوركس والأسواق المالية الأخرى,20.5
311538,Foundations of Front-End Web Development,20.5
278948,Become a Professional Graphic Designer,20.5
1155262,"Angular 2 Complete E-Commerce App Course - Java,Spring,MySQL",20.5
1128050,"Server API Development in Swift, Kitura, & Bluemix",20.5
1000010,Professional Ruby on Rails Developer with Rails 5,20.5
822514,CAIIB Advanced Bank Management (Part I),20.5
880202,Anatomy and Figure Drawing for Beginners,21.0
764076,Learn Bootstrap3 With Multi Purposes Single Page Layout,21.0
390866,The Complete Web Developer Bootcamp - Beginner to Expert,21.5
12975,Introduction to Java Programming for Online Learners,22.0
756150,Angular 4 (formerly Angular 2) - The Complete Guide,22.0
495958,Build Advanced Responsive Websites with Foundation 6 & SASS,22.5
563020,Learn to build 20 websites and build 14 iOS9 apps with swift,22.5
629142,The Ultimate Web Developer How To Guide,22.5
877124,The Complete jQuery Course - From Beginner to Professional!,22.5
266252,Projects in PHP and MySQL,23.0
574974,The Complete Piano Course - Master The Piano,23.0
976854,Spring 4 Mastercourse: Covers Annotation & XML Configuration,23.5
1240730,Architectural Drawing For Creatives,24.0
73860,Financial Risk Manager (FRM) Certification: Level I,24.0
64739,Professional Risk Manager (PRM) Certification: Level 1,24.0
789324,Complete Web Development Course + Building 5 Websites!,24.5
471440,Accounting and Finance for Bankers - A Comprehensive Study,24.5
658766,Advanced Financial Management for CA / CS / CFA /CPA Exams,24.5
169662,Capital Market Immersion,24.5
978728,"Thoughtful Web Development Course: HTML, Vue.js, PHP, MySQL",25.0
883000,Complete WordPress Theme Developer Course With Bootstrap,25.0
552258,Professional WordPress Theme Development from Scratch,25.5
1042110,"Beginner Full Stack Web Development: HTML, CSS, React & Node",25.5
826366,Building a ASP.NET MVC 5 Membership Website,25.5
70640,Python Programming: Create an Digital Marketplace in Django,26.0
186096,"Core: A Web App Reference Guide for Django, Python, and More",26.0
484132,MBA Accounting and Finance for Managers(Paper MS04 of IGNOU),26.0
705264,Modern React with Redux,26.5
11174,Become a Web Developer from Scratch,27.5
206088,Guitar Chord Mastery!Turn Your Brain Into A Chord Encyclopia,28.5
494800,Accounting Basics - A Complete Study,29.0
758582,PHP with Laravel for beginners - Become a Master in Laravel,29.5
485889,Cost Accounting - A Comprehensive Study,29.5
967486,الدورة الشاملة illustrator from zero to hero,30.0
238934,Pianoforall - Incredible New Way To Learn Piano & Keyboard,30.0
