course_id,course_title,content_duration
348116,Photoshop In-Depth: Master all of Photoshop's Tools Easily,4.5
1143148,PHOTOSHOP: Dessiner l'affiche du film Rogue One en style BD,4.5
190816,IAS 18 - Revenue,4.5
720994,Gestão Financeira Para Pequenas e Médias Empresas,4.5
843620,Learn Adobe InDesign from Scratch,4.5
525818,JavaScript High Performance,4.5
19421,Free Beginner Electric Guitar Lessons,4.5
319020,Investing: How I Consistently Beat The Stock Market,4.5
684794,Build Web Apps Using EmberJS: The Complete Course,4.5
1018380,Forex Trading Like Banks – Step by Step with Live Examples,4.5
434100,CFA® Level 1 2014 – FI,4.5
902480,Pure Rock Guitar : Play Like the Gods of Rock!,4.5
831066,Learn MQL5: Build an 8-Currency Hedging Robot (MetaTrader 5),4.5
644654,Learn Basics of South Indian Carnatic Flute - Level 2,4.5
1199928,The Complete Canva Course,4.5
239268,Level 1 2014 CFA® Program – Equity Investments,4.5
913768,Illustrator CC 2016 Power Workshops (Deutsch),4.5
833770,Practical Financial Statement Analysis,4.5
792232,Most Wanted Flat Design Techniques,4.5
165964,Stock Trading Ninja: Complete System For Trading Success,4.5
713258,Bookkeeping Basics:  Understand the Fundamentals,4.5
1051856,Classical Guitar Essentials - The Basics Part 2,4.5
673196,Introduction to Frontend Web Development For  Beginners,4.5
199822,IAS 12 - Accounting for Income Taxes (Basics),4.5
733922,Aprende el acordeón de oído y con técnica –Nivel Intermedio–,4.5
772618,Learn Object Oriented PHP By Building a Complete Website,4.5
733694,How to create a  video blog with WordPress,4.5
653846,Master the MEAN Stack - Learn By Example,4.5
1035940,Professional RESTful API Design using Python Flask,4.5
843854,The Complete Guide to Professional Trading with Elliott Wave,4.5
988678,Curso de piano 101 - Tocando partituras y acordes -,4.5
552504,Introduction to Options - Strategies For Consistent Profits,4.5
759972,150 Rock Guitar Licks You MUST Know,4.5
636418,Learn Ruby on Rails for Absolute Beginners,4.5
1164876,3DS MAX - Learn 3Ds MAX tutorial for Beginners in Urdu Hindi,4.5
889438,ChatBots: Messenger ChatBot with API.AI and Node.JS,4.5
1203894,How To Make an eCommerce Website With Wordpress 2017,4.5
1178226,Learn to Create a Mandala with Adobe Illustrator,4.5
159760,Create A Custom Responsive WordPress Website For A Client,4.5
572268,AngularJS For .Net Developers From Scratch,4.5
1132162,Investimento em Ações,4.5
1194232,Learning Path: Akka: Building Applications and Microservices,4.5
1024800,دورة شامل لبرنامج إلستريتور للمبتدئين - Adobe illustrator CC,4.5
1158854,Affinity Designer for beginners,4.5
869312,TAKE NOTE BEGINNER CLARINET!  –  Fun with Fundamental Skills,4.5
991290,Dynamic JavaScript Master Class AJAX JSON Simple APIs,4.5
128946,Learn Responsive Web Development from Scratch,4.5
518870,How to create flat design icons in 15 minutes in Illustrator,4.5
638204,Playing Piano By Ear: Complete Guide for Aspiring Musicians,4.5
612528,Corporate Finance and Alternative Investment for CFA L1,4.5
24334,CSS Development (with CSS3!),5.0
459926,Advanced Tuba Studies - Become a Master of the Tuba!​,5.0
795278,"Build Ajax Web Apps with Laravel 5.2, Bootstrap and jQuery",5.0
610812,Portfolio Management CFA L1 2016,5.0
602702,Wordpress for beginners :Build Websites Fast without Coding ,5.0
182940,Modern Piano Lessons For Beginners,5.0
667332,Robots de Forex: espere ganar 175%p.a! Incluye Robot de Fx! ,5.0
590406,Learn ReactJS: Code Like A Facebook Developer,5.0
1214702,Three Steps Trading - Live Trading - Real Account,5.0
964732,"Modern Web Development with SASS, Gulp, NPM & Web Workflows",5.0
854746,Freelancing A-Z: How To Start A Successful Freelance Career,5.0
1078254,Tally ERP Complete Training in Urdu / Hindi,5.0
457206,Learn to Play Bassoon: Beginner to Pro in Under Four Hours!,5.0
871358,Financial Modeling and Valuation: Complete Beginner to Pro,5.0
865634,Learn to Draw Pretty Faces for Comic Books,5.0
17922,Play Ukulele Now,5.0
286160,Making Killer Images in Photoshop that WOW Clients!,5.0
58791,Toon Boom Studio Tutorial - Cartoon Animation Made Simple,5.0
368786,Drupal for Beginners,5.0
174562,Learn to Play Saxophone: Beginner to Pro in Under Four Hours,5.0
354324,Accounting 2 Simplified for You,5.0
381330,Live Account - ETF Trading System - Hacking The Stock Market,5.0
199450,"Elite Trend Trader: Learn To Trade Stocks, Options & Forex",5.0
988804,7 Steps: Your Introduction to Trading,5.0
616818,JavaScript and jQuery Basics: Start The Journey,5.0
408232,CFA® Level 1 2014 – Quantitative Methods,5.0
965870,Angular and Firebase - Build a Web App with Typescript,5.0
761584,Guitar Lessons - Soloing With Arpeggios - Essential Guide ,5.0
51752,Just chords Piano: Learn to Play Piano Quickly - No Music,5.0
537748,What is Bitcoin,5.0
961996,Learn Reactivex From Ground Up,5.0
876850,HTML5 Specialist: Comprehensive HTML5 Training,5.0
347104,Learn to Play the Oboe: Beginner to Pro in Under Four Hours,5.0
311638,Joomla 3 : Develop a Professional Website in 3 Simple Steps!,5.0
177584,Adobe InDesign CS6,5.0
1119610,Harmonica Jamz: The Only Course on Jammin' with Friends,5.0
766906,Smashing Photoshop CC/CS,5.0
737642,How To Design A Fortune 500 Logo in Illustrator,5.0
929146,Learn Stock Options: Options Made Simple 101,5.0
73046,CFA Level I Foundation Course: Introduction to Quants,5.0
548068,JavaScript Fundamentals,5.0
735796,Object Orientation in PHP,5.0
484670,Guitar Super System Level 1,5.0
1075662,Learning Docker and Kubernetes by Lab,5.0
822670,JavaScript - Tricks and Workarounds,5.0
1227578,Learning Path: The Road to Elasticsearch,5.0
771044,"Make Money With Photoshop: Logos, Business Cards & Brochures",5.0
678142,PHP Login and Registration System - Email Confirm Activation,5.0
1231872,Web Development With HTML CSS BOOTSTRAP JQUERY for Beginners,5.0
1005658,Trading for Beginners - Intermediate Level,5.0
529828,Python for Trading & Investing,5.0
648174,Buchführung lernen leicht gemacht,5.0
406504,Become an InDesign Pro in 10 Skills,5.0
502240,"Value Investing, Taught by Six Superinvestors",5.0
383414,Beginner to Pro in PowerPoint: Complete PowerPoint Training,5.0
605074,Advanced Flute Studies - Learn to Master the Flute!​,5.0
477702,Python for Beginners: Python Programming Language | Tutorial,5.0
791414,JavaScript programming: JavaScript for beginners,5.0
884988,Build a Complete Registration and Login System using PHP MVC,5.0
801702,"Geld verdienen mit dem Ticken der Uhr, wie Warren Buffett!",5.0
368908,JavaScript from Scratch for Very Beginners,5.0
797038,Learn jQuery by Example Course,5.0
767256,Mastering Technical Analysis : Maximizing Trading Profits,5.0
1206414,Excelを使ってビジネスシミュレーション：基礎編,5.0
1052180,"How to play 'Electric Guitar"",https://www.udemy.com/electric-guitar-beginners-method/,true,50,1105,5,20,Beginner Level,2 hours,2016-12-29T00:24:06Z
42038,Learn Piano Today: How to Play Piano Course in Quick Lessons""",5.0
113518,CSS and CSS3 For Absolute Beginners,5.0
1166070,Complete Bootstrap 4 course - build 3 projects,5.0
598846,Forex para Principiantes-Ejemplos en VIVO de Trading Real,5.0
425086,Implementing a Data Warehouse with SQL Server 2012 ,5.0
673142,master course - realistisch zeichnen lernen,5.0
308696,Forex MetaTrader 4: Master MT4 Like A Pro Forex Trader,5.0
1259422,Learn JavaScript From Scratch:Become Top Rated Web Developer,5.0
1078522,React JS and Redux - Mastering Web Apps,5.0
1065250,Up and Running with jQuery,5.0
592338,Forex Trading Secrets of the Pros With Amazon's AWS,5.0
38456,Essential Options: Strategies for Mastering the Stock Market,5.0
529424,How to Become a Financial Analyst from Scratch!,5.0
133968,Web Elements Design With Photoshop,5.0
372518,Ruby On Rails For Web Development,5.0
482834,HTML5 for beginners,5.0
657764,Digital Photo Manipulation Art And Cover Design In PhotoShop,5.0
820194,Photoshop for Entrepreneurs - Design 11 Practical Projects,5.0
1193950,Sintetizadores e Síntese Subtrativa,5.0
552700,Your Second Course on Piano: Two Handed Playing,5.0
1097778,ASP.NET MVC 5 Project - Facebook Clone,5.0
494058,Expert Guide : Mastering Shapes Creation with Illustrator,5.0
30911,HTML5 APIs For JavaScript - A Course For Web Developers ,5.0
720356,Projects in Node.js - Learn by Example,5.0
1247394,Cryptocurrency Trading: Complete Guide To Trading Altcoins,5.0
1016420,Введение в Финансовую Инженерию,5.0
676764,Create Your Own Automated Stock Trading Robot In EXCEL!,5.0
175278,How to Design Your Own Guitar,5.0
609642,Ferramentas Visuais,5.0
530092,Mastering CSS,5.0
502204,Dibujo digital básico: cómo ilustrar en Photoshop,5.0
637840,Learn Knockout JS Framework from GroundUp,5.0
177912,All You Need To Know About AngularJS - Training On AngularJS,5.0
882128,The Complete JavaScript Bootcamp,5.0
907444,SAP FICO For Beginners - A Guide to SAP Financial Accounts,5.0
933394,The Complete Guide to Forex Trading,5.0
757508,"Financial Accounting, its Cycle, Statements & Analysis",5.0
406054,Photoshop: Real World Learning,5.0
837950,Customizr - Learn WordPress with the ultimate creative theme,5.0
1115348,"Full stack Universal React with Redux, Node js and MongoDB",5.0
903326,CPA 10 COMPLETO,5.0
581598,Commodity Futures Day Trading Strategies,5.0
1252630,React JS - Mastering Redux,5.0
614472,The Advanced Forex Course for Smart Traders,5.0
153210,Learn Accounting. Understand Business.,5.5
1080466,Curso Completo de Bitcoin - Ganhe 0.00005 Bitcoin,5.5
297742,Build a DCF Valuation Model,5.5
537282,Hosting Django: Amazon Web Services (AWS) Fundamentals,5.5
476000,Easy Piano for Kids - Complete Beginner Piano Course,5.5
941998,"Master Electron: Desktop Apps using HTML, JavaScript & CSS",5.5
551702,Learn to make websites with Google's Material Design Lite,5.5
846156,JavaScript Complete Guide to learning JavaScript,5.5
582636,Bootstrap unleash the power faster & easier web development,5.5
1039062,Webpack 2: The Complete Developer's Guide,5.5
308690,Forex Trading A-Z™ - With LIVE Examples of Forex Trading,5.5
537896,Risk Analysis - Capital Budgeting for CA / CS / CFA exams,5.5
991630,Try Django 1.10 | Create a URL Shortening Service,5.5
312834,Professional Trading With Institutional Supply & Demand,5.5
617976,Curso Completo del Mercado FOREX,5.5
331968,Trading: From Wall Street to Your Street,5.5
721274,Learn to Play Irish Fiddle,5.5
309820,ASP.Net MVC Quick Start,5.5
657518,Cracking the Violin Code!,5.5
158830,Samuel and Co Trading - Stock & Forex Trading,5.5
180680,Master the Saxophone: Intermediate Instruction Made Simple!,5.5
256094,Financial Management - Ratio Analysis,5.5
1063430,How to Build WordPress Themes: A Web Designer's Guide,5.5
306556,Backbone Tutorial: Learn Backbonejs from Scratch,5.5
945978,Ultimate Angular 4 (previously Angular 2) with Bootstrap 4,5.5
808292,Take your double bass drum technique to the next level,5.5
585496,Ultimate AngularJS: Build a Real-World App from Scratch,5.5
943306,Learn Node.js by building Udemy: Stripe + MailChimp + Wistia,5.5
584410,The Ultimate Guide to Dividend & Dividend Growth Investing,5.5
214418,Piano Lessons For The Hip Hop Fan,5.5
1066002,Leve a sua técnica de pedal duplo para um novo patamar,5.5
859446,Cross-Platform Development with ASP.NET Core 1.0 MVC,5.5
255170,Bitcoin - The Complete Guide,5.5
994754,The Power Modeling Bootcamp: Advanced Excel in 10 Days,5.5
890810,Practical Understanding of PHP and MySQL,5.5
356840,Logo design: How To Design an Awesome Logo in Illustrator,5.5
436488,Futures/Commodity Trading,5.5
990532,Advance Unix : File Processing: AWK | SED | GREP | CUT | VIM,5.5
1178762,WordPress Development - Themes and Plugins Complete Guide,5.5
982860,Django + AngularJS for a Powerful Web Application,5.5
909244,Docker for Developers - Newest Version 1.12 with Swarm Mode,5.5
949134,The Extreme Web Development Course - For Beginners,5.5
722274,The Complete Investing Guide: How to Beat Wall Street,5.5
934574,Basics of Commerce A Complete Study,5.5
505208,Programming Foundations: HTML5 + CSS3 for Entrepreneurs 2015,5.5
400464,Introducción al trading de opciones,5.5
572744,Trend Traders Club: How To Find And Trade Fast Moving Trends,5.5
207304,Aprende a tocar la guitarra eléctrica,5.5
1078208,Spring Boot Tutorial For Beginners,5.5
1094964,Build Your Own Backend REST API using Django REST Framework,5.5
571730,Invierte en la Bolsa Mexicana y de USA,5.5
586680,Mestres do Photoshop,5.5
349142,Master Oboe Playing: Intermediate Instruction Made Simple!,5.5
398798,Forex: Learn to Trade Forex and FX Consistently,5.5
528104,Stock Trading Strategies: Profitable Trading in 7 Days.,5.5
471588,Learn how to INVEST for huge profits or make it big trading!,5.5
501412,Play Piano by Ear Today! SuperCourse,5.5
1009622,超基礎！超入門！〜作りながら学ぶ。完全無料3DCGソフトBlender〜,5.5
374652,Sketch 3 - New Guide To iOS 8 Mobile App Design (2015),5.5
365292,Play Sonny Terry style on Harmonica and dazzle your friends!,5.5
999262,Forex online live trading system (Special Offer),5.5
1195742,The Music Coach Online Spirit Drum Course,5.5
907386,How To Create A Wordpress Website 2016 | NEW Divi Theme 3.0!,5.5
928040,Learn Spring Framework Practically - Hands On Recipies,5.5
965832,The Complete Investment Banking Course 2017,5.5
260470,Forex Robots: Expect To Earn 175% P.A. Forex Robot Included!,5.5
744696,Logo Design for Everybody,5.5
725658,FOREX : LearnTo Trade the Improved ( Advanced ) Patterns,5.5
41356,Create a Responsive Business Website with WordPress,5.5
1088656,Quantitative Trading Analysis with Python,5.5
443502,Essential Finance For Managers,5.5
645714,Build Apps with ReactJS: The Complete Course,5.5
52457,The Logo Design Process From Start To Finish,5.5
513846,７日でマスター  ビギナー向け Adobe Illustrator　どきどきセミナー,5.5
536780,Adobe Illustrator CC - From scratch ,5.5
35409,Profits Turbo,5.5
1093446,ABC do Adobe Illustrator,5.5
815182,Saxophone Pro Series - You're going to love practicing Sax,5.5
600206,Business Accounting Made Easy,5.5
1052304,JavaScript For Beginners : Learn JavaScript From Scratch,5.5
1084454,CFA Level 2- Quantitative Methods,5.5
380668,All-in-One Premium Design Course - Scratch to Pro+ Edition,5.5
768028,* An Integrated Approach to the Fundamentals of Accounting,5.5
83736,Small Biz Doers' Guide to Small Biz Accounting + Bookkeeping,5.5
490392,Getting Started with Illustrator CC,5.5
758208,HTML 5 and CSS 3 - tricks and workarounds,5.5
470412,"Essential HTML, CSS & HTML5 Training",5.5
37684,Learn To Program JavaScript (in ten easy steps),5.5
73044,CFA Level I Foundation: Introduction to Financial Reporting,5.5
614668,8 Steps To Achieve Financial Freedom And Escape Debt,5.5
771198,Reactive JS:  Are you ready for the next big paradigm shift?,5.5
425084,Administering Microsoft SQL Server 2012 Databases - 70-462,5.5
851560,Learn To Build Apps Using Play Framework,5.5
812588,The Complete jQuery Course: From Beginner To Advanced!,6.0
1145430,Angular Styling & Animations (for Angular 2 and Angular 4),6.0
482534,Ultimate Retirement: Build Your Own Dynamic Retirement Plan,6.0
406820,RESTful API with Laravel,6.0
523312,Python Web Programming,6.0
1250742,Complete GST Course For Small and Medium Enterprises,6.0
390096,"How to Fund your Million Dollar Idea: Equity, Debt, Unfund",6.0
846832,So you think you know JavaScript?,6.0
443584,Option selling trading as income source. Beginners friendly,6.0
160322,Basics of Finance and Budgeting,6.0
281690,A Very Complete Introduction To Laravel,6.0
785388,Scaling Docker on AWS,6.0
815672,Finanzas Personales para Vivir Libre de Deudas,6.0
405926,HTML and CSS for Beginners - Build a Website & Launch ONLINE,6.0
810576,Clarinet Pro Series - Fall in love with the Clarinet,6.0
658816,Learn How to Improvise on Guitar in 30 Days,6.0
477634,Adobe Illustrator CC - Print Design for Beginners,6.0
758216,Sistema Completo De Guitarra Rítmica Para Principiantes,6.0
192576,Certificate Program In Management Accounting,6.0
823860,Trumpet Pro Series - You're going to love practicing Trumpet,6.0
821788,Angular 2 Fundamentals for Web Developers,6.0
920604,Intro to Financial Modeling,6.0
461176,Build an Advanced Single Page with Bootstrap & WordPress,6.0
1225030,Learning Path: Magento: Master and Test Magento 2 with Ease,6.0
416282,How to Build Your Own Website with WordPress: A Step-by-Step Guide ,6.0
1189280,Introduction to Node.js for Beginners,6.0
886614,Accelerated ES6 JavaScript Training,6.0
768366,Photoshop Fantastic! - The Comprehensive Guide to Photoshop,6.0
146450,A Year's Worth of Piano Lessons in One Weekend,6.0
19164,Graphic Design Secrets Revealed,6.0
1189508,Create a social network using PHP Mysqli HTML Css and JQuery,6.0
908996,Parse Server: From Front End to Full Stack,6.0
1177156,Como Criar Logos de Sucesso - Start Designer,6.0
575040,Typography From A to Z,6.0
419318,AngularJS Masterclass - Deep Dive & Understand AngularJS,6.0
303042,Photoshop CS 6 ile Fotoğraf İşlemenin Temelleri,6.0
948440,PSD to Responsive HTML5: Beginner to Advanced,6.0
419308,TRADING TACTICS,6.0
501502,Learn Financial Accounting Different,6.0
514036,Crystal ball trading - foresee price with seasonal patterns,6.0
561800,Intro to Adobe Illustrator,6.0
338926,Learn to Play Clarinet: Beginner to Pro in Under Five Hours,6.0
103144,Forex Elite Trading,6.0
738726,Learn HTML and CSS to make a Website,6.0
130298,Financial Modeling in Excel for Startups,6.0
429866,From Drawing to Illustration,6.0
903140,The Complete hapiJS Course - Go From Beginner To Advanced!,6.0
749686,How to Play the Guitar: Your 30-Day Guide to Learn Guitar,6.0
459804,Learn to Play the Tuba: Beginner to Pro in Under Five Hours!,6.0
577256,Accounting Department's Tips & Tricks - Beginner to Advanced,6.0
1223000,Innovators and innovation: Travel through time!,6.0
324226,Master Flute Playing: Intermediate Instruction Made Simple!,6.0
725566,Curso de Violão Popular,6.0
799434,"Economics:   Competition, Elasticity, a little Game Theory",6.0
471328,Advanced Euphonium Studies - Learn to Master the Euphonium!​,6.0
374566,Learn to Play Percussion: Beginner to Pro made the Easy Way!,6.0
923146,CSS Specialist: Comprehensive CSS Training,6.0
559328,Cómo usar Metatrader 4 para hacer trading?,6.0
472526,PHP for Beginners,6.0
976284,Mastering DevOps,6.0
764534,Guitar Lessons - Learning The Neck - Fretboard Mastery,6.0
832478,"JSON with Java APIs, jQuery and JSON REST Web Services",6.0
420652,AngularJS Custom Directives with Dan Wahlin,6.0
1095116,Penny Stocks King: How 2 really Trade Penny Stocks (6 Hours),6.0
488818,QuickBooks 2015 Training for Newbies,6.0
804298,Corporate Finance 101: Equity Valuation,6.0
1089652,"Web Application Development using Redis, Express, and Socket",6.0
1034560,"Erfolgreich als Signalgeber/in, per Social- und Copytrading",6.0
1128662,Volatility Trading Analysis with R,6.0
812370,Bassoon Pro Series - You're going to love practicing Bassoon,6.5
953220,Creative Perspective Illustration with GIMP,6.5
517466,Day Trading: High ROI Day Trading ,6.5
981600,HTML and CSS BootCamp for Beginners,6.5
655298,Learn Facebook Flux Architecture for Web Applications,6.5
759130,Flute Pro Series - You're about to love practicing the flute,6.5
778084,Ruby on Rails a Beginners Guide ,6.5
459468,Advanced Bassoon Studies - Learn to Master the Bassoon!​,6.5
438420,Ultimate Guide on Freelancing Career in Photoshop Design,6.5
151956,Responsive Web Design: Made Easy,6.5
631754,Zend Framework 2: Learn the PHP framework ZF2 from scratch,6.5
959586,Javascript from Beginner to Advanced Level,6.5
1204590,Angular Advanced MasterClass & FREE E-Book,6.5
1179104,Learning Path: React: Make Stunning React Websites,6.5
50522,Become Exceptional in HTML and HTML5,6.5
502588,Learn GIMP,6.5
709324,Learn Web Development by Creating a Social Network,6.5
925854,No Bull Investing: Investing 101 For Financial Freedom,6.5
384928,101 Blues riffs - learn how the harmonica superstars do it,6.5
863812,Spring Core DevOps on AWS,6.5
826568,Fundamentals of Angular 2 Full Stack Design,6.5
1088924,Mastering Photoshop Elements 15 Made Easy Training Tutorial,6.5
511942,Master EmberJS : Learn Ember JS From Scratch,6.5
1262470,Corel Draw X8 Başlangıç Eğitimi (YENİ),6.5
258232,Algorithmic Trading In Forex: Create Your First Forex Robot!,6.5
997964,"Build An Online Bank With Java, Angular 2, Spring and More",6.5
696616,Stock Market for Beginners - Complete Starter Toolkit,6.5
861624,ES6 Javascript: The Complete Developer's Guide,6.5
911474,Complete Wordpress Theme Development Course,6.5
42146,Advanced Finance and Accounting for Startups,6.5
1241518,Node Package Manager Course: Build and Publish NPM Modules,6.5
615920,In Depth Web Development Made Easy,6.5
1037666,Webpack 1 & 2 - The Complete Guide,6.5
1035472,Python for Finance: Investment Fundamentals & Data Analytics,6.5
362530,Public Speaking: You Can Give Great Financial Presentations,6.5
337072,Bestseller! Learn Photoshop in 1 Hour (No Experience Needed),6.5
611308,Complete PHP and MySql Course: From Beginner to Professional,6.5
1078520,"Internal Controls - Design, Implementation and Monitoring",6.5
572270,Angularjs-WebApi2-EFCodeFirst Web App On 3-Tier Architecture,6.5
833398,Angular Masterclass,6.5
656522,Ruby on Rails Foundations,6.5
765238,Trading Algorítmico en Forex: Crea tu primer Robot de Forex!,6.5
885443,Investment Portfolio Analysis with R,6.5
258886,HTML5 Geolocation in Depth:Build 7 HTML5 Geolocation Apps,6.5
839536,Start Making Comics with Manga Studio 5 / Clip Studio Paint,6.5
535650,Accelerate Your Guitar Learning With Metal Techniques,6.5
1172166,WordPress for Beginners 2017 + Google AdSense Implementation,6.5
920544,React Redux React-Router: From Beginner to Paid Professional,6.5
892446,Visualizing Data,6.5
837798,✔️ Illustrator CC : Be a Graphic Designer in Illustrator CC,6.5
270808,Projects in Django and Python,6.5
690918,Domina el Diseño Gráfico para Web con Photoshop CC,6.5
550360,GIMP for Beginners. Make Your Own Professional Book Covers,6.5
380970,The Complete Bitcoin Course: Get .001 Bitcoin In Your Wallet,6.5
661878,Learn to Build Web Apps using Laravel Framework,6.5
1153876,"Term Loan Appraisal for bankers, credit analysts",6.5
1062048,Mastering Photoshop CC 2017 - The Art of Design & Technology,6.5
422012,Querying Microsoft SQL Server 2012 - (Exam No. 70-461),6.5
130064,Practical PHP: Master the Basics and Code Dynamic Websites,6.5
416548,Logo Design Masterclass: Learn Logo Design + Illustrator,6.5
528488,Introduction to Equity Markets,6.5
1032234,Mastering the Market : (Technical Analysis + Candlestick),7.0
574132,Como utilizar o Corel Draw por completo!,7.0
324224,Learn to Play the Flute: Beginner to Pro in Under Five Hours,7.0
364206,Media Training for Financial Service Professionals,7.0
173888,AngularJS for the Real World - Learn by creating a WebApp,7.0
30243,Mastering HTML5 Programming - The Easier Way,7.0
185266,Master Trumpet Playing: Intermediate Instruction Made Simple,7.0
30261,"Kids Coding -Introduction to HTML, CSS and JavaScript",7.0
552594,Create Complete Web Applications easily with APEX 5,7.0
344348,Master the Clarinet: Intermediate Instruction Made Simple!,7.0
147174,Blues Accelerator - 21 Days to Blues Guitar Mastery,7.0
720300,Logo Design Theory & Application Bootcamp,7.0
1153854,"Working Capital assessment for bankers, credit analysts",7.0
440006,X theme for WordPress: Responsive web design without code!,7.0
1196544,Python Algo Trading: Sentiment Trading with News,7.0
297762,Build a Trading Comps Valuation Model,7.0
532008,Web Development Essential Skills - Complete HTML and CSS,7.0
375830,Guitarra Desde Cero - PARTE 1,7.0
703770,MQL4 Programming for Traders: Build Robust Trading Robots!,7.0
642410,The Complete Bootstrap Masterclass Course - Build 4 Projects,7.0
531290,"Essential JavaScript, jQuery and AngularJS Training",7.0
443746,The WpFASTER WordPress Speed Optimization Master Course,7.0
828042,SAP - Learn SAPUI5 Professional Development,7.0
792216,Stock Technical Analysis with R,7.0
1114470,Adobe Photoshop CS6 para Iniciantes,7.0
1012040,Bootstrap Bootcamp - Responsive web development- 8 projects,7.0
255604,Intro to Illustrator,7.0
676554,Master WCF 4.0 From Scratch Using C#,7.0
529028,WordPress Plugin Development for 2017 - Build 14 Plugins,7.0
289230,Learn and Understand AngularJS,7.0
363078,Capital Structuring Techiques for CA / CFA / CPA Exams,7.0
947098,Understanding TypeScript,7.0
1189288,Drupal Tutorial : Drupal 8 Beginner to Expert in 8 PROJECTS,7.0
832410,Stock Technical Analysis with Excel,7.0
14571,Learn HTML5 At Your Own Pace. Ideal for Beginners,7.0
936182,Learn By Example: Angular JS,7.0
384318,WordPress for Beginners - Build Your First Website in 2017,7.0
1124970,Javascript ES6! A Complete Reference Guide to Javascript ES6,7.0
917432,The Professional Bass Masterclass,7.0
470472,Learn to Play Euphonium: Beginner to Pro in Under Five Hours,7.0
106156,"Create, Update and Manage Your Own Website Using Drupal 7",7.0
834600,The Web Developers Guide: Learn HTML & CSS Fundamentals,7.0
902888,Investment Portfolio Analysis with Python,7.0
134144,Ruby on Rails: Training and Skills to Build Web Applications,7.0
824020,Trombone Pro Series - Fall in love with the Trombone,7.0
958132,Learn By Example: jQuery,7.0
1039930,"Wie Du, Dir auch mit kleinen Beträgen ein Vermögen aufbaust",7.0
814474,Oboe Pro Series - You're going to love practicing the Oboe,7.0
619610,Advanced Horn Studies - Learn to Master the French Horn!​,7.0
718338,How To Confidently Join The Bitcoin Revolution,7.0
20185,The Complete Forex Trader,7.0
294292,Technical Analysis 101: Ten Primary Candlestick Reversals,7.0
874960,"Build a Responsive Website with HTML5, CSS3 and Bootstrap 4",7.0
1009068,ABC do Photoshop CC,7.5
184780,Learn to Play the Trumpet: Beginner to Pro Made the Easy Way,7.5
263846,Master the French Horn: Intermediate Instruction Made Simple,7.5
