course_id,course_title,content_duration
884658,Investing in Stocks? Master The Art of Covered Calls Selling,3.0
1108666,Worship Piano: From Beginner to Pro,3.0
219878,Aprende a tocar el contrabajo sin complicaciones,3.0
725872,Certificate in MYOB AccountRight Premier 2017 Course,3.0
1252318,The Complete HTML and CSS Course For Beginners,3.0
1148412,Building a eCommerce Startup in 4 Hours [Livestream],3.0
1052518,Master the Art of Web Design with HTML & CSS,3.0
212438,Aprende todos los secretos de la salsa para piano,3.0
285638,Learn to Trade for Profit:Trading with Japanese Candlesticks,3.0
195196,Aprende a improvisar en la guitarra eléctrica,3.0
693726,Mastering Meteor: Reactive Full Stack JavaScript,3.0
1076920,Stock Market investment: Practical Accounting,3.0
597164,Learn to Trade for Profit: Finding Winning Stocks - Chinese,3.0
123242,Surviving Introduction to Finance,3.0
697798,"Complete guide to install Wordpress, PHP on Cloud,AWS or VPS",3.0
505780,"How to Register a Domain, Set Up Hosting, and Edit Web Pages",3.0
953490,TopTrader Academy - Complete Options Course,3.0
576906,"Technical Analysis Primer for trading Stocks, Bonds & Forex",3.0
647520,誰でもわかる Adobe Illustrator CS6,3.0
370752,How to Make a Wordpress Website 2017,3.0
738552,Building a Website With Jekyll,3.0
366608,Building Web Applications with Spring MVC,3.0
569436,How to Become an Accountant from scratch!,3.0
696342,FOREX: From Zero To Hero,3.0
679158,Build your own Beautiful Blog in WordPress + SEO,3.0
567070,Accounting Made Easy 2,3.0
1263966,Advanced Technical Analysis PART1!,3.0
953442,Blues School! A Course For Beginners in Blues Piano & Improv,3.0
929016,HTML and HTML5 For Beginners 2016,3.0
382786,Sass Workflow,3.0
1090194,All in one HTML CSS and JQuery,3.0
1067516,Vector Logo Design in Affinity Designer,3.0
904076,"Learn Rails: Quickly Code, Style and Launch 4 Web Apps",3.0
1089744,How To Make A Wordpress Website 2017 - Divi Theme Tutorial,3.0
566248,jQuery Fundamentals Powerful Bootcamp for beginners,3.0
809968,Tenor Saxophone Lessons For Beginners,3.0
866460,Angular 2+ with Typescript - Essential Training,3.0
658764,Forex Management - Detailed Study for CA / CS / CFA Exams,3.0
555340,Play Piano in 30 Days! - Start Playing NOW!,3.0
619856,French Horn Solos: Learn how to Perform Three Fun Pieces!,3.0
745306,"Build Realtime Apps | React Js, Golang & RethinkDB",3.0
8324,Javascript for Beginners,3.0
109988,Understand Banks & Financial Markets ,3.0
972126,Forex Trading Masterclass - Learn To Trade Better,3.0
192870,Trading Penny Stocks: A Guide for All Levels In 2017,3.0
229360,Level 1 2014 CFA® Program – Corporate Finance,3.0
405840,Regular Expressions for Beginners - Universal,3.0
478598,Forex Prep Academy for Beginners-Real trades!,3.0
654038,How To Sell Your Art Online With ETSY,3.0
53256,Bootstrap Basics: Program Responsive Websites,3.0
1029440,Modern Rock Guitar Techniques,3.0
823494,Comment jouer du Pianoforte,3.0
749468,Kostenrechnung lernen leicht gemacht,3.0
1185535,Cómo crear maquetas con Adobe XD,3.0
1217408,Drums for Beginners,3.0
1045726,Stock Market investment:Non financial fundamental analysis,3.0
387348,Financial Statement Fundamentals for Small Biz & Investors,3.0
824034,Technical Analysis: Understanding Price Action,3.0
619716,Easy Market Profits: 3 Step Stock Investing Strategy,3.0
544234,Mike G's Beginner Drum Course: Part 1,3.0
883138,Pop and Jazz Keyboards and Harmony (beginner level),3.0
959144,Practical Accounts APP Overview,3.0
712994,Learn Wave accounting to maintain books properly,3.0
511934,AngularJS For Beginners,3.0
1175694,Get a Credit Repair Publication On Amazon and Live LIFE..,3.0
159070,Introduction to Web Development: HTML,3.0
1174086,Precificação - Calculando valor de venda baseado nos custos,3.0
352782,トレーディングビュー徹底攻略2017年版,3.0
424864,Write PHP Like a Pro: Build a PHP MVC Framework From Scratch,3.0
468182,Ilustración de la A a la Z,3.0
536166,TRADING MARKET MAP,3.5
326310,Get Piano Skills TODAY!!! ,3.5
933260,jQuery Essentials: Learn the Fundamental of jQuery,3.5
661774,JSON in Action: Build JSON-Based Applications,3.5
352748,Getting Started with Magento,3.5
602032,Ultimate Stock Market Investing: Learn How to Value Stocks,3.5
897238,Canva Graphics Design for Entrepreneurs - Design 11 Projects,3.5
1265678,CORSO COMPLETO DI E-ON VUE X-STREAM PER TUTTI,3.5
371074,Sketch 3 from A to Z: Become an App Designer,3.5
396204,Graphic Design Masterclass: Learn Graphic Design in Projects,3.5
1107986,Building Data Visualizations with D3 and Angular 2,3.5
904890,React for visual learners,3.5
402508,Codeless Website Development with Adobe Muse,3.5
761770,Learn HTML5 Canvas for beginners,3.5
462668,How To Build A Website From Scratch + Blogging Blueprint,3.5
854756,Learn Drupal 8 - With a Live Project,3.5
287010,HTML & CSS - Learn to build sleek websites ,3.5
217320,Aprende a tocar el saxofón como siempre has querido,3.5
557208,Accounting - Basic Costing ,3.5
711688,Learning Photoshop CC 2014 in Egyptian Arabic ,3.5
403604,Web Development with BootStrap - 16 Instant Themes Included!,3.5
692812,Play all major scales by ear - no notation required!,3.5
1146288,Jews Harp - Advanced course,3.5
680180,Learn to Build Web Apps using D3JS,3.5
1025536,Coach Guitar - Amazing New Way To Learn Guitar With Colors,3.5
35131,Introduction to Small Business Accounting Training Tutorial,3.5
364616,Learn how to quickly build websites using Wordpress,3.5
276680,Cómo Diseñar Logos,3.5
365816,Build Professional WordPress Website,3.5
557436,ACCA MA1 Management Information,3.5
591116,Master Typescript : Learn Typescript from scratch,3.5
467238,Advance Technical Analysis,3.5
672086,誰でもわかる Adobe Photoshop CS5,3.5
587902,Core HTML How to get online quickly HTML to HTML5 ,3.5
806536,Master Riot: Learn Riot.js from Scratch,3.5
1134842,Easy Guitar Songwriting And Harmony,3.5
125162,Create and Deploy a Web App in 3 Hours,3.5
1038538,Introduction to QGIS Python Programming,3.5
542254,Web Programming Course : Asp.Net MVC,3.5
1223012,"Mastering 'Native CSS Shapes To Build Modern Web Pages""",3.5
1158836,PHP Specialist (2017 Edition),3.5
793234,Piano From Zero To Pro - Beginner Essentials To The Piano,3.5
543090,Introduction to Coding with Ruby,3.5
670034,Advanced Javascript,3.5
674646,PHP Essential How to create build Amazing websites with PHP,3.5
460056,Learn the Basics of Programming for Marketers,3.5
1232390,Corporate Ethics,3.5
657734,Complete AJAX Course: Learn AJAX Techniques Using Bootstrap,3.5
629044,Inspirational Web Development - A Beginner Approach -,3.5
811416,Learn Financial Modeling from Scratch - Part1,3.5
331970,Learn Oud 1 (No Prior Music Knowledge Required!),3.5
813360,Learn Financial Modeling from Scratch - Part 2,3.5
581498,Contabilidad Gubernamental en México,3.5
1100054,FOREX TRADING - Learn in a quick + profitable way + support,3.5
543212,Forex Trading using professional indicators by TOP traders,3.5
987865,Make Patterns in Illustrator,3.5
1240522,Learn Bootstrap And Make Responsive Websites,3.5
807934,The 80/20 Guitar: Write Music and Play Guitar in 30 Days,3.5
1205894,Create a MEAN App by Example - Full Stack Course,3.5
742712,CSS Tutorial For Beginners: Style Your Wordpress Templates,3.5
922464,Create Awesome Ebook Covers Using Microsoft Word,3.5
17887,JavaScript with BackboneJS and Bootstrap CSS - Advanced,3.5
987064,Learn by Doing: Vue JS 2.0 the Right Way,3.5
661802,JavaScript Design Patterns: 20 Patterns for Expert Code,3.5
1196700,Le basi del trading online,3.5
56970,Drum Set for Beginners,3.5
1203040,Google Blogger Course,3.5
918688,How I Make Consistent Returns Trading Options,3.5
650328,JavaScript Complete for beginners with real world Apps,3.5
217978,ブルースギター入門,3.5
20150,iPhone icons gone awesome,3.5
97338,Forex Basics,3.5
1181578,Deinen Roman setzen mit PagePlus in 10 einfachen Schritten,3.5
511952,Investment Banking: How to Land a Job on Wall Street,3.5
197828,Learn to Setup Websites from Scratch,3.5
975906,The Sass Course! Learn Sass for Real-World Websites,3.5
1223570,Learn How To Play 25 Classic Hip Hop Songs Ch.2,3.5
1056848,Joomla for Beginners - Learn how to build a website with CMS,3.5
455120,Life Coach Business Basics: Finance and Operations,3.5
211052,Aprende todos los secretos de la guitarra flamenca,3.5
872816,Adobe Illustrator in Under 10: Fast info at your Fingertips!,3.5
777654,Learn what's new in PHP 7,3.5
429662,Trend Following Stocks: A Complete Trading System,3.5
180372,Mortgage Backed Securities,3.5
967058,Ethereum Developer: Build A Decentralised Blockchain App,3.5
425910,How to Optimise Your WordPress Website's Speed & Security to Improve SEO & User Experience,3.5
98706,Stock Market for Beginners. Learn to trade,3.5
1013314,PHP For Beginners : Learn PHP From Scratch!,3.5
814848,WordPress Basics to Business: Share and Sell your Expertise,3.5
646918,Aprendiendo Piano: Tocando piezas populares Vol.I,3.5
673420,HTML CSS JavaScript: Most popular ways to code HTML CSS JS,3.5
361286,Wealth Management,3.5
647338,How To Make Money With A Cover Band,3.5
782194,Canvas image Creator HTML5 JavaScript project from Scratch,3.5
1102436,Learn 10 Scottish Tunes Piano Easy Level,3.5
179500,Interest Rate Swaps,3.5
1156648,Learn ASP.Net Web API 2 for Absolute Beginner,3.5
311846,How to Create Vector Characters in Illustrator or Photoshop,3.5
368679,Mastering Magento,3.5
500628,Angular 2 Demystified,3.5
537008,Be a Bootstrap Developer from scratch,3.5
1245356,Photoshop - Revelando os segredos das Fusões,3.5
447210,Photoshop | GIMP: Quick & Easy Image Hacks for Beginners,3.5
446736,Amazon s3 Mastery - THE How-To' Guides For Amazon S3,3.5
1023668,Supreme NodeJS Course - For Beginners,3.5
939882,Adobe Illustrator: Learn Easy Logo Design.,3.5
214828,"Aprende a tocar percusiones: congas, bongós, maracas y más",3.5
897314,HTTP Clients with Laravel: Use and Consume Services and APIs,3.5
720814,First Steps to Trading the Forexmarkets : Technical Analysis,3.5
391546,Learn Python and Django: Payment Processing,3.5
910650,Forex Trading: Comprehensive & Concise Forex Trading Course,3.5
326948,Working Capital Management for CA / CFA / CPA Exams,3.5
322118,IFRS Financial Reporting,3.5
180547,PHP Development with the Laravel Framework,3.5
1039596,Build Complex Express Sites with Redis and Socket IO,3.5
148028,Become a Career Day Trader: Asian-Pacific Futures Markets,3.5
59014,Coding for Entrepreneurs Basic,3.5
723878,Bootstrap 4 Beginners: Code a Responsive Landing Page,3.5
736836,The Investment Banking Recruitment Series,3.5
1127048,ASP.NET C# - Enterprise Web Systems From Novice to Expert,3.5
687742,こどもギターレッスン　リトルギタリストⅡ,3.5
1024844,"Build A Web App with VueJS, Spring Framework and MongoDB",3.5
59725,Small Business and Managerial Accounting Training Tutorial,3.5
624016,TRADING FOR A LIVING: Trading Full-Time Transition Guide,3.5
380582,Learn OAuth 2.0 - Get started as an API Security Expert,3.5
1141614,The Fun and Effective Piano Course,3.5
527834,"HTML5, CSS3 & Bootstrap - How to Create a Responsive Website",3.5
207166,How to Copy the Best Traders on Etoro,3.5
367460,Complete Digital Painting Training with Corel Painter,3.5
985922,Excel Crash Course: Master Excel for Financial Analysis,3.5
749616,Alternate Picking Speed & Accuracy,3.5
168358,Basel II,3.5
753610,Trading mit kleinen Konten - Grundlagen die du kennen musst,3.5
217628,Aprende a tocar el acordeón de botones,3.5
742764,Piano With Willie: Basics of Improvisation,3.5
245722,Painless Piano!,3.5
672112,誰でもわかる Adobe Illustrator CS5,3.5
742300,Piano With Willie: Jazz Kids - Vol 4,3.5
1128560,JavaScript - Become Higly Paid Front End Developer,3.5
805336,Introductory Forex Trading Course,3.5
1227322,React vs Angular vs Vue.js by Example,3.5
637974,Master ExpressJS to Build Web Apps with NodeJS&JavaScript,3.5
258894,How to Read a Balance Sheet,3.5
598722,"Build, Grow, and Protect Your Assets: A Step-by-Step Guide",3.5
1048182,Coach Guitar - Apprendre la GUITARE facile avec des COULEURS,3.5
13216,Aprende a Tocar Teclado - Piano,3.5
1085580,"RSI, Options Trading & Technical Analysis (3 Course Bundle)",3.5
537884,Leasing - A Comprehensive Study (Professional Course Level),3.5
405818,Javascript for Beginners Learn by Doing Practical Exercises,3.5
309370,Bootstrap 3 -> Profitable WordPress Theme Development!,3.5
1216554,Photoshop isn't like what you imagine A to Z .,3.5
673016,Build A Career In Forex Trading- Learn Fundamental Analysis,3.5
192726,Logo Design for Entrepreneurs ,3.5
1153710,Learn Adobe Photoshop from scratch to professional,3.5
548764,ACCA FA1 Recording Financial Transactions,3.5
1142428,Photoshop CC 2017 Full Course,3.5
1110470,The Passive Investing Blueprint - Build Wealth Passively,3.5
770622,Bring your sketch to life - learn digital illustration,3.5
212520,Aprende a tocar ritmos latinos en el teclado,3.5
585946,Beginner Guitar Lessons by Paul Gronow,3.5
284076,Automate Web Development With Gulp JS,3.5
446608,AJAX : Let's build a COOL project,3.5
275294,FastTrack to Stock Trading Strategies,3.5
95176,ChalkTalk: Financial Accounting,3.5
743568,"Financial Analysis, from Scratch to Professional!",3.5
635570,A Guide to Analog Synths: For the modern EDM enthusiast.,3.5
981684,Adobe InDesign CC Advanced,3.5
575880,The Complete Wordpress Course - Build Your Own Website Today,3.5
1184664,Design Business Card in Photoshop: Earn Money by Doing It,3.5
1226518,Photoshop & Illustrator CC Essentials in Arabic,3.5
217540,Aprende a tocar el bajo eléctrico ,3.5
672090,Learn to Build Web Apps using UnderscoreJS : Code Like a Pro,3.5
1168172,Case studies on credit appraisal for bankers,3.5
1000136,"Basics of Fixed Income Valuation, CFA Level I 2017 Prep",3.5
1180960,Estruturação Financeira,3.5
670640,31 Day Guitar Challenge,3.5
551072,Build Websites from Scratch with Squarespace,3.5
742106,Credit Risk Analysis,3.5
1123226,MasterClass-Japanese &  Heiken Ashi CandleStick Patterns,3.5
1138162,Le basi del Trading,3.5
101500,Guitar Lessons - Blind Blake - King Of Ragtime Blues Guitar,4.0
628440,Inkscape For Beginners 2016/2017,4.0
746014,The Complete Sass & SCSS Course: From Beginner to Advanced,4.0
639126,６時間でインターバンク市場を攻略！最短距離でトレード基礎力,4.0
476622,Basel Norms (Basel 1/ Basel 2/ Basel 3) Simplified,4.0
925286,Play Piano To-day! - Beginner Piano Lessons For Busy People!,4.0
41884,Getting Started with Playing Guitar,4.0
446936,Creative logo design with Inkscape for free,4.0
861742,Motion Graphic With After Effect From Scratch in 5 Hours,4.0
334838,Economics - CFA Level 1 - 2014,4.0
105350,Play Piano Today - Easy Festive Favorites & Piano Party Hits,4.0
592606,Spielend Klavier lernen mit Freude und Erfolg,4.0
1136446,Adobe Illustrator CC Beginner,4.0
671960,Angular 2 Jump Start With Typescript,4.0
598516,jQuery for Beginners,4.0
1050168,Forex Trading : Power Of Moving Averages,4.0
798740,Forex Traders - Create Your First Trading Robot. No Coding!,4.0
598266,Trading for everyone - The Independent Investor Course I,4.0
877036,Sara Learns to Code.  Making an App from Scratch,4.0
370440,Bitcoin For Beginners,4.0
996320,Shopping Cart Website from Scratch Ecommerce,4.0
231256,FOREX Currency Trading For Beginners,4.0
1207112,30 Day Guitar Jump Start for Success,4.0
825354,React.js Quickly: Developing Scalable Web User Interfaces,4.0
685190,Crowdfunding for Filmmakers,4.0
364716,"Beginner Violin 101: Care, Maintenance, and the Right Gear",4.0
552650,Beginner Piano,4.0
1090788,First Web Application with Spring Boot,4.0
959604,Angular JS Essentials,4.0
1229274,WP Plugin Development - Build your own plugin!,4.0
510784,WordPress 2016 for Beginners : Build awesome websites!,4.0
746790,"JavaScript, jQuery and Ajax",4.0
596192,PSD To a Creative Landing Page Using Twitter Bootstrap 3,4.0
201812,Design Beautiful & Professional Ebooks Using FREE Software,4.0
1270222,Learning Path: Web Applications with Spring and Angular,4.0
994740,Create an eCommerce Wordpress Website 2016 - New Divi Theme!,4.0
746432,Start Trading Stocks Using Technical Analysis!,4.0
702138,Bitcoin Investing: The Complete Buy & Hold Strategy,4.0
129274,Aprende a Ganar Dinero en la Bolsa,4.0
928858,Learn How To Build A Professional Web Site By Using Joomla,4.0
791610,Create a business website with WordPress,4.0
651352,Curso de Maya 3D,4.0
495484,JavaScript for beginners with live examples,4.0
1222836,Case Studies in Macro Economics,4.0
549064,Web Development Tools the Pros Use: Code Productivity Hacks,4.0
553832,Create Professional Character Designs in Photoshop,4.0
772950,Learn How to Trade The Stock Market,4.0
151027,"Introduction to Guitar 'A Course for Beginners"",https://www.udemy.com/introduction-to-guitar/,true,25,163,11,56,Beginner Level,2.5 hours,2014-10-30T15:59:39Z
650804,Guitar  Master Class Learning How to Play Guitar from A to Z""",4.0
877968,Start-up financial modeling for non-finance professionals,4.0
288850,Make Logo design pay with illustrator in less than a day,4.0
22825,Beginner Guitar Method,4.0
642060,Tradeonomics - Four Steps to Mastering Economic Indicators,4.0
883324,Corel Draw X7: Mão na Massa,4.0
372234,Hands-on Financial Modeling (With 6 Excel Templates),4.0
1254172,Responsive PHP Registration Form: From Scratch,4.0
516394,Book Covers and Graphic Design with PowerPoint 2013/2016/365,4.0
213984,Aprender a tocar la batería sin salir de casa,4.0
821526,How To Make A Business Website In 1 Day With Wix FAST & EASY,4.0
899702,Advanced Oboe Studies - Become a Master Oboist!​,4.0
667992,Learn Symfony 3 framework by practical examples,4.0
874166,Angular 2 Crash Course with TypeScript,4.0
944594,Strategy layout and Backtesting,4.0
46927,Basics of Business Finance,4.0
153926,BITCOIN VISUALLY. Part I.,4.0
399640,Intro To HTML & CSS: Web Development For Beginners,4.0
669270,JQuery Essentials core training for Dynamic Interactive web,4.0
1003250,World Percussion: Complete Lessons for Everyone,4.0
517148,Acoustic Fingerstyle Guitar Course: Beginner to Advanced,4.0
147104,Aprende a tocar Guitarra RAPIDO y FACIL con Guitarsimple,4.0
602450,6 Must Know Tricks to Successful Solos,4.0
834558,What Finance Job is for You? Explanation of 14 Finance Roles,4.0
226084,"IAS37 - Provisions, Contingents Liabilities & Assets",4.0
926206,HTML5 and CSS3 : Landing Pages for Entrepreneurs 2016,4.0
1246636,Photoshop - Como criar Fusão de forma profissional,4.0
719920,Hands-On Guitar: The Beginner's Guide,4.0
178602,Capital Market Road Map,4.0
298558,Advanced Accounting for Investment Banking,4.0
81278,How to draw Caricatures,4.0
1200874,Become PHP Facebook Developer: Password-Less Authentication,4.0
358326,Dividend Investing: Build Your Portfolio for a Better Future,4.0
204014,Aprende a tocar el piano desde cero,4.0
722174,Forex Trading MAKE YOUR FIRST TRADE TODAY!,4.0
932842,Piano Lesson Variety,4.0
910838,The Complete Web Development Tutorial Using React and Redux,4.0
295909,Legal Accounting,4.0
184324,Advanced Saxophone Studies - Learn to Master the Saxophone!,4.0
180362,The Securities Trade Lifecycle,4.0
328960,Your Own Site in 45 Min: The Complete Wordpress Course,4.0
1196816,From 0 to 1: Bond Theory and Valuation,4.0
380092,HTML & CSS for beginners: Build 3 projects from scratch,4.0
783748,Byte-Sized-Chunks: Cascading Style Sheets (CSS) with HTML,4.0
975060,Learn React JS from scratch,4.0
8325,HTML Tutorial: HTML & CSS for Beginners,4.0
364986,Apple Watch Design,4.0
552198,Complete Login and Registration System in PHP and MYSQL,4.0
924216,Django For Beginners,4.0
446478,Learn basics of South Indian Carnatic Flute Step by Step ,4.0
566920,WordPress for Beginners - Tutorial - From Novice to Know-How,4.0
956888,Tumult Hype Pro Basics: HTML5 Animations Made Easier,4.0
562668,Financial Accounting Made Easy for All,4.0
413180,Digital Painting for Cartoon Characters,4.0
504168,Learn Flute FAST!,4.0
140168,"Learn to Play Tarrega, Bach, and Sor on Classical Guitar",4.0
427066,Flamenco Guitar,4.0
657710,Ruby on Rails for Complete Beginners,4.0
564966,The Complete Chart Pattern Trading Course: A Proven Approach,4.0
586914,Aprende Photoshop con Ejercicios Prácticos.,4.0
966794,"WordPress Development With NodeJS, Gulp, Composer & More",4.0
513958,Complete JavaScript Course for Beginners with Easy Examples,4.0
980114,The Complete TypeScript Programming Guide for Web Developers,4.0
704732,Learn and Earn with HTML & CSS,4.0
496006,Learn Laravel: Create Your Web App Step-By-Step,4.0
1011550,Build Sign Up and Login Forms With Bootstrap Modal,4.0
881778,資産運用の基礎を学ぶファイナンス入門,4.0
931626,Learn to Trade With Fibonacci Tools,4.0
645890,Aprende desde cero a operar el mercado de divisas FOREX,4.0
1083784,Crie seu Cartão de Visita no CorelDRAW X8,4.0
1027812,Build A Weather App With Ajax Using Open Weather Map API,4.0
16646,Web Programming with Python,4.0
429308,Read financial statements like a pro,4.0
808542,Sketchbook Pro for Beginners,4.0
738910,[Value Investing] Where White People Keep Their Money,4.0
695656,The Complete JavaScript Course For Web Development Beginners,4.0
1049380,画像加工の初心者だとしても、１週間でホームページのトップ画像を製作できるようになる画像製作講座,4.0
73080,Step-by-step HTML and CSS for Absolute Beginners,4.0
1144780,Curso de batería online de Patricio Iglesias (Santa Sabina),4.0
1086834,How To Make A Wordpress Website 2017 | Divi Theme Tutorial,4.0
945602,PHP User Login Registration Script With All Features,4.0
409618,"Build a Real Time web app in node.js , Angular.js, mongoDB",4.0
1187758,Options Trading Essentials: The ULTIMATE Guides,4.0
551170,Your First Course on Piano,4.0
258954,CFA Level 1 - Derivatives,4.0
602218,Mastering JavaScript,4.0
613422,Business Economics - Basics (College Level),4.0
812602,Piano Lessons For Beginners,4.0
188498,Advanced Trumpet Studies - Learn to Master the Trumpet!​,4.0
28172,Practical Trading on Financial Futures & Options Markets,4.0
355622,Trade Forex 13 Patterns - Golden Ratios Secret Revealed,4.0
647564,React: Learn ReactJS Fundamentals for Front-End Developers,4.0
628606,Piano Lessons for Beginners: Play the Piano AND Read Music!,4.0
28295,Learn Web Designing & HTML5/CSS3 Essentials in 4-Hours,4.0
652438,The Complete PHP CodeIgniter Course: Beginner To Advanced,4.0
620372,Piano for Kids: Developing Your Child's Creative Abilities,4.0
716310,Create a Powerful Website with the Cool Bootstrap Framework,4.0
559512,The Complete HTML5 & CSS3 Course Build Professional Websites,4.5
588764,Stock Options Day Trading Mindset for Success,4.5
712960,"Angular 4 - Concepts, Code and Collective Wisdom",4.5
1165096,Vue JS - Mastering Web Apps,4.5
1072220,Reach Your Personal Financial Goals the Easy Way (2017 UK),4.5
773502,Financial Accounting Part 2 - Passing The Class,4.5
147908,JavaScript for Beginning Web Developers,4.5
851868,Build a Business or Personal Website Using Wordpress,4.5
574082,"Web Scraping with Python, Ruby & import. io",4.5
641236,Basic JavaScript: Build 4 Basic JavaScript Projects,4.5
192724,Certificate Program in Financial Accounting,4.5
178776,Fixed Income Securities,4.5
1196728,From 0 to 1: Investments and Portfolio Theory,4.5
530436,InDesign: Diseño de proyectos paso a paso,4.5
796188,Step by Step Classical Guitar Course,4.5
647276,Acoustic Blues Guitar Lessons,4.5
112602,"Learn Guitar The Easy Way, It's Faster",4.5
373556,Advanced Clarinet Studies - Learn to Master the Clarinet!,4.5
519212,Awesome Lead Guitar 1,4.5
741172,Piano With Willie: Jazz Kids - Vol 1,4.5
324656,Forex Trading,4.5
403628,Bookkeeping to Command Senior Bookkeeping Wages,4.5
340844,Learn HTML & CSS: How To Start Your Web Development Career,4.5
986832,Adobe Photoshop CC Introduction,4.5
984072,"Build Modern Websites Quick With HTML,CSS and Bootstrap",4.5
971110,The Truths about (in)secure Retirement,4.5
482208,Learn Photoshop CC Essentials,4.5
941310,Matemática Financeira com HP12C e MS Excel,4.5
912996,The Bubble Course - Create Complete Web Apps without Coding,4.5
983534,Try AngularJS: Beginner's Guide to Front End Web Development,4.5
1210098,HTML5 and CSS for Beginner To Expert,4.5
11153,Learn jQuery: An In-depth Course For Beginners,4.5
681878,Devenez le king de l'illustration automobile,4.5
977516,Wordpress for Non-Technical People,4.5
456388,Adobe Photoshop CC | The Essential Guide,4.5
255592,Guía práctica para comprar acciones en la Bolsa de USA,4.5
468726,Learning Axure RP,4.5
986442,JavaScript Tutorial,4.5
736250,Mastering Thymeleaf with Spring,4.5
200854,HTML and CSS Crash Course for Beginners,4.5
473622,Comprehensive TypeScript,4.5
914164,Forex Basics: Learn how to read and analyze Forex charts,4.5
353044,Investing 101: The Complete Online Investing Course,4.5
888716,"Introduction to Finance, Accounting, Modeling and Valuation",4.5
1082996,Pimcore Developer: Implement a Blog from a Bootstrap Theme,4.5
741898,Practical Accounts & Bookkeeping Automated Overview ,4.5
44836,Option Spreads and Credit Spreads Bundle,4.5
532140,Getting Started With Photoshop CC,4.5
286424,Learn to Design a Logo in Adobe Illustrator,4.5
1079078,Drupal 8 Site Building,4.5
552606,Beginner Guitar Essentials,4.5
734280,Aprende a llevar la contabilidad de forma informatizada,4.5
777276,Financial Accounting Part I - Passing the Class,4.5
831294,Make Your Own Ukulele,4.5
568322,How to Play Dan Fogelberg Songs on Guitar,4.5
724824,Photoshop　中級者、上級者がプロになるために最後に学ぶ「超絶技巧」テクニック,4.5
1045862,Create eye-catching WordPress website from scratch,4.5
178640,Introduction to Web Development,4.5
412970,Classical Guitar Essentials - The Basics Part 1,4.5
179820,Introduction to Futures & Options,4.5
1023650,Financial Modeling for Professionals in 1 Day!,4.5
502772,The Complete Value Investing Course: A Proven Approach,4.5
691180,An Abundance Mindset: How to Craft Yours,4.5
