course_id,course_title,content_duration
1193056,Trader sur le Forex avec Ichimoku,2.5
1075366,Adobe InDesign CC 2017 Quick Start,2.5
1080584,Adobe Photoshop CC for Photographers Advanced,2.5
422546,Piano - Circle of 5ths to Play A Song in 12 Keys in 12 Days,2.5
690966,Learn Azure Cloud Step by Step,2.5
521952,Ultimate Guide To Trading Engulfing Candlestick Strategy,2.5
1140532,Explore JavaScript Beginners Guide to Coding JavaScript,2.5
851288,Smart Trading Techniques for Safe & Consistent Weekly Result,2.5
638040,Adobe Photoshop Essentials: Master Adobe Photoshop CS6,2.5
172898,Fundamental Financial Math,2.5
1021104,Aprenda a Investir seu Dinheiro,2.5
59535,HTML for Beginners,2.5
1095488,Adobe photoshop The  Flying Land compositing,2.5
922600,CSS Web Development Crash Course,2.5
826912,Six Stage Negotiation,2.5
131562,Piano With A Pro,2.5
774910,WordPress: Create an Amazing Website With Ease,2.5
1006314,Financial Modeling for Business Analysts and Consultants,2.5
812610,Trumpet Lessons For Beginners,2.5
589900,The 7 Day Guitar Method,2.5
295843,Introduction to Laravel 4,2.5
584522,Voiceover Audio Secrets - Your Way to Top Audio Quality,2.5
1258402,Canva Complete Course For Graphics Design | 20 Projects,2.5
463834,Cost Accounting Overheads (Professional Course Level),2.5
1010988,Economics for beginners - Various Concepts,2.5
396888,Introducción a la Contabilidad,2.5
792703,Create WordPress Plugins,2.5
595258,Finance for Non-Finance: Learn Quick and Easy,2.5
818786,Drum Lessons For Beginners,2.5
664764,Mike G's Beginner Drum Course: Part 2,2.5
326244,"Installing Wordpress 4 - Installation, Registrars & Hosting",2.5
1266468,Indesign - Para quem quer trabalhar com Design Gráfico,2.5
945320,Javascript Intermediate level 2 - Mastering Functions,2.5
869716,株式投資で本当のテクニカル分析ができるようになる,2.5
138560,Credit Repair from a Financial Institution,2.5
218540,Aprende a tocar el violín desde cero,2.5
1223336,Photoshop Essentials - Uma Introdução Detalhada,2.5
632234,Guitar Chords and Basic Strumming,2.5
1183094,"ASP.NET Core MVC, Quick and Practical",2.5
538540,Forex Trading vs Option Trading,2.5
803664,How to invest in Gold,2.5
1019918,Master Angular 2 - The No Nonsense Course,2.5
849632,Write a Successful Business Grant Proposal,2.5
253810,"IAS 8-Accounting Policies ,Changes in Accounting Estimates",2.5
1159988,Electric Guitar for Beginners - RockStarter Level 1,2.5
1036400,"Piano Unbound. Piano learning method, a course for beginners",2.5
541824,FX Commodity Chart Trading Patterns for Success,2.5
302456,Bookkeeping Made Simple,2.5
1151342,How to Design Simple Promotional Materials in Photoshop,2.5
1015308,Mobile App Design in Photoshop from Scratch - UI & UX DESIGN,2.5
1170894,Python Algo Stock Trading: Automate Your Trading!,2.5
1209694,Become A Forex Trader - Forex trading like a professional,2.5
760066,Blues Guitar Lessons - Volume 1 - Blues Shuffle Essentials,2.5
663702,Graphic Design: Double Your Sales With Canva,2.5
454724,Cost Accounting Marginal Costing Theory and Practice,2.5
997916,Amazon Alexa Development: From Beginner to Intermediate,2.5
611804,Primeros Pasos con Photoshop CC,2.5
601092,Curso de Diseño e Ilustracion de Armas para Videojuegos,2.5
1002282,Bitcoin - Ethereum: Trading -Watch me manage my own account!,2.5
698278,Financial Statements Analysis: Learn to Invest Like a Pro!,2.5
1231958,60 Minutes to Fundamental Accounting Skills,2.5
546656,How to Trade Commodity and Financial Futures for a Living!,2.5
686430,Curso de Corel Draw: Como Hacer Todo para tu Fiesta Temática,2.5
530426,Become A Logo Designer ,2.5
240256,Forex Breakout Profits: The Definitive Guide,2.5
615106,Ultimate guide to Social Media Web development integration ,2.5
364810,Double your Forex Account using the MAGIC MA trading robot,2.5
17349,Figure Drawing From Life Using The Reilly Technique.,2.5
488220,Drupal Views: Introduction to Enhancing Your Drupal Website,2.5
244000,Forex Trading: The High ROI Forex Trading End of Day Course,2.5
532216,Raising Capital for Your Business,2.5
611688,PSD to Bootstrap 3 for Beginners using HTML & CSS,2.5
326338,OpenCV Computer Vision Application Programming ,2.5
937134,Javascript Intermediate level 3 - JSON,2.5
99826,Become A Web Developer And Seller - Build Websites With HTML,2.5
935900,Pedais de efeito para Contrabaixo,2.5
609992,HTML CSS: Essential steps to learn HTML CSS,2.5
1127988,Angular Tutorial For Beginners,2.5
42197,Options Spreads Bundle-  the heart of Options Trading,2.5
507778,How to become a successful day trader,2.5
430992,Mundharmonika spielen - mein schönstes Hobby,2.5
737832,Bitcoin Peer Investing: How To Generate Double Digit Returns,2.5
288258,"Learn to Code in HTML5, CSS3, and JavaScript",2.5
688244,How I Make Money Writing About Stocks Online,2.5
651032,Wordpress - Create an Outstanding Website in 2 hours,2.5
326428,Learn Piano Scales: Play any song in any key! Like Pro's do,2.5
128950,Learn to Build Websites using Twitter Bootstrap,2.5
689868,The Binary Institute -  Binary Options Trading Course,2.5
1123250,Master Class Piano Techniques: Tips To EZ Coordinate 2 Hands,2.5
970874,"Complete AJAX Using Bootstrap, PHP From Basic To Advanced.",2.5
934614,Beginners Guide to Stock Market Investing,2.5
179824,Equity Products,2.5
961774,ABC DO VIOLÃO E GUITARRA,2.5
891484,Forex Trading - Advanced Fundamental Analysis,2.5
723818,Adobe Indesign CC Başlangıç,2.5
314698,Learn Photoshop Quickly (For Bloggers & Web Images),2.5
1008654,Learn Photo Manipulation - Build 3 projects,2.5
421054,Auditing Basics (Professional Course Level),2.5
358062,Financial Modeling: Build a Complete DCF Valuation Model,2.5
700080,Budgeting for Business,2.5
1105904,Learn How To Play 25 Classic Hip Hop Songs,2.5
471446,Cost Accounting Crash Course,2.5
344180,Play the Jews Harp - instant skills for non musicians.,2.5
617158,Unit Testing AngularJS: Build Bugfree Apps That Always Work!,2.5
101864,Programming for Entrepreneurs - JavaScript,2.5
1191088,Learn to play in the Key of G on any Bluegrass Instrument,2.5
198692,Acoustic Guitar After The Basics,2.5
1051430,Intermediate Accounting 1: Easy. Fast. Simple!,2.5
1160066,Classical Guitar Technique: 80/20,2.5
597084,Don't Let Your Customers Run Your Business,2.5
581256,Django Tutorial: Build Your First App Fast & Free! ,2.5
109622,Finance - Ratios Analysis & Interpretations,2.5
561188,Photoshop CC for Beginners - A Comprehensive Crash Course,2.5
873844,Building Web Apps Using Flask and Neo4j,2.5
704582,"Jekyll: make fast, secure static sites and blogs with Jekyll",2.5
946326,"Learn Calligraphy, Handwriting animation wz After Effects",2.5
971962,Learn Guitar: Zero to Guitar Fingerpicking in 30 days,2.5
897162,101 Awesome Rockabilly Guitar Licks,2.5
50528,The Complete Wordpress Plugin Development Course - 8 Plugins,2.5
876646,Direction-Independ Trading - Elite Forex Traders  Strategy,2.5
494078,Expert Guide : Mastering Functions in JavaScript !,2.5
327788,Bitcoin - A Comprehensive Guide,2.5
1007396,"Play The Piano By Ear | Master Class, Learn By Doing",2.5
642940,Build A YouTube Downloader With C# And GitHub,2.5
743634,Piano With Willie: Blues n' Boogie Vol. 1,2.5
1103448,Learn how to convert PSD to HTML and CSS responsive,2.5
239416,Level 1 2014 CFA® Program – Derivatives,2.5
71912,Have Fun with Beginner Blues Piano,2.5
1223310,Aprende escalas y arpegios Vol.2 : Modo menor,2.5
1251654,Understand Core Finance Principles in 60 Minutes,2.5
53157,Beginning Flute Lessons,2.5
671578,Forex SOS Course: Trading Tweaks And Working Forex Strategy,2.5
754524,Fundraising Success: The Art & Science of Major Gifts,2.5
861528,PHP Security,2.5
595818,Laravel Account Activation Project,2.5
641732,Css For Beginners,2.5
1126016,Portrait Typography in Photoshop - Anyone can do Typography,2.5
560990,JavaScript DOM Dynamic Web interactive content Boot Camp,2.5
476880,Financial Model Fundamentals-Learn the Essential Skills,2.5
371828,Manual Bookkeeping,2.5
1092766,Create Mobile App Design from Scratch in Photoshop,2.5
860656,GraphicDesign Studio,2.5
743884,Piano With Willie: Blues n' Boogie Vol. 3,2.5
298522,Navigate the 10-K and Other Financial Reports,2.5
1169196,"Credit concepts and checklist for bankers, credit analyst",2.5
358998,Sketch 3: Design a mobile application from scratch,2.5
635716,Typography: Learn the Foundation and Designs,2.5
721202,Guitar 201: Breakthroughs,2.5
911318,Master ECMAScript 2015 (ES6),2.5
20387,Guitar Insanity Workout - Eatmystrings!,2.5
584758,Bootstrap 3 Beginners: Create a Professional Landing Page,2.5
688092,JQuery Create Overlay Popups from scratch using Jquery,2.5
467186,HTML5 and CSS3 -Start building beautiful websites,2.5
661780,JavaScript Promises: Applications in ES6 and AngularJS,2.5
743914,Value Investing For Beginners,2.5
951608,Learn the Viola - Scales and Fundamentals,2.5
831940,Fundamentals of Accounting for Business Owners,2.5
98140,Introduction to Bootstrap 3,2.5
436210,The Pro Ruby on Rails Starter,2.5
188064,"Trumpet Solos: Learn how to Perform Three Fun, Unique Pieces",2.5
662318,Learn Quickbooks to maintain books properly,2.5
522426,Design & Create Vector Graphics With Inkscape 2016,2.5
1282064,Cryptocurrency (BTC & ETH) Investment & Trading Course 2017,2.5
429366,Become a Logo Designer: Guide to Complimentary Logo Software,2.5
1133648,Fantasy map design,2.5
507486,Technical Analysis 101: Secrets of Trading Revealed,2.5
479496,Basic Technical Analysis,2.5
520468,Canva : Graphic Design Theory Volume1,2.5
1132694,Introduction to Gypsy Jazz Guitar,2.5
269082,Photoshop: Real World Hands-on Freelance Mastery,2.5
736940,Practical CSS Website Development: Crash Course ,2.5
211780,Aprende a tocar el teclado como los expertos,2.5
1068590,Wordpress Website Mastery 2017,2.5
1084642,Chart Patterns Trading Demystified,2.5
236070,Forex Harmonic Trading- With Multiple Forex Chart Examples,2.5
1135712,Mastering Modern Web Development Using React,2.5
185092,Design while you learn InDesign CC,2.5
1234656,4 Week Rhythm Mastery,2.5
553582,Learn JavaScript from scratch,2.5
585174,Adobe Illustrator Fast Track,2.5
401784,Options Trading Introduction: Day Trade Stock Options,2.5
826202,Design a unique bookstore-quality Photo Book with Blurb,2.5
1140232,Devtools 2017: Beginner to Expert w/ Chrome Developer Tools,2.5
883828,T-Shirt Design Workshop 02: Mixed Media Design,2.5
785210,Flute Lessons For Beginners,2.5
360916,Hot Trading Investing Strategy: ETF and Futures,2.5
471352,"Euphonium Solos: Learn to Perform Three Fun, Unique Pieces!",2.5
597424,Sell like a Pro: Insider Secrets of Successful Selling!,2.5
177472,Nuke X: Aprende composición digital,2.5
674350,Mastering Futures Options for Beginners - Your Top 5 Plays!,2.5
607362,Accounting 101-Master Class for Understanding Business,2.5
1226182,Design Tickets and Vouchers in Photoshop and Illustrator,2.5
891490,"Accounting Superpowers: Learn Accounts, Understand Business!",2.5
20461,How to Design a Logo - a Beginners Course,2.5
498488,Your First Successful Forex Trades - With Case Studies,2.5
743674,Piano With Willie: Blues n' Boogie Vol. 2,2.5
663696,Blues Guitar Lessons: Play Like the Greats - All Levels,2.5
1051570,Transfer Pricing A Complete Analysis,2.5
269006,Learn Html5 & CSS3 from scratch,2.5
1156530,How to trade in the Forex market,2.5
378924,"Learn animation using CSS3, Javascript and HTML5",2.5
424770,Book Design With MS Word And Canva ,2.5
455680,Create a Membership Site with Wishlist Member & Wordpress,2.5
1201912,high swing - كورس لتعليم جميع مراحل احتراف تداول الفوركس,2.5
260900,Quick & Easy Piano Chords: Play more songs with more chords,2.5
633606,The Ultimate jQuery Course,2.5
724596,Tax Preparation: Learn Fast! Prepare Taxes with Confidence!,2.5
413182,Play By Ear #4: Play Song By Ear with 3 Chords Using Any Key,2.5
475914,Chugging - it don't mean a thing if it ain't got that swing!,2.5
1016536,Learn How to Manage & Customize  Web Sites By Drupal CMS,2.5
920424,Option Trading for Rookies: Basic Option Strategies,2.5
286898,"Aprende a tocar el Acordeón 'de oído y con técnica"",https://www.udemy.com/aprende-a-tocar-el-acordeon-de-oido-y-con-tecnica/,true,25,93,21,34,Beginner Level,4 hours,2014-09-16T19:51:45Z
263432,Aprende los Secretos de la Armónica con HARP&SOUL""",2.5
1103590,Trading con retrocesos de Fibonacci,2.5
1120554,Canva Graphics Design Essential Training For Everyone,2.5
19422,Drupal 7 for Beginners,2.5
1276364,Bitcoin & Ethereum Course (2 Course Bundle),2.5
850294,The Everyday Investor: Building Wealth with Venture Capital,2.5
645634,How to Build Profitable FOREX Automated Trading Strategies!,2.5
732556,PHP: Complete Registration and Login with Email Verification,2.5
596026,Trade for Profit: Find-Trade Stocks Successfully Arabic عربي,2.5
727510,How To Become An Etsy Wholesale Seller,2.5
1236746,WordPress Tips and Tricks,2.5
514844,Contabilidad Financiera: Conoce el Lenguaje de los Negocios.,2.5
895302,Adobe After Effect: Create 15 Advance Motion Graphic Element,2.5
1048188,Modern Country Guitar: Technique Booster,2.5
937206,Learn PHP CodeIgniter Framework with AJAX and Bootstrap,2.5
560996,You can create Incredible Websites with HTML CSS learn how,2.5
617886,Learn Rails Programming in Less than 2 Hours,2.5
749560,HTML5 CSS3 JQUERY Single Page Website Project from Scratch,2.5
476268,Options Trading 3 : Advanced Stock Profit and Success Method,2.5
522784,Create an Accelerated Learning Flowchart with Watercolors,2.5
1209556,Hedge Fund Trading Systems Part Two - Stocks & ETFs,2.5
482924,Mastering Retouching and Restoration (15 projects Included),2.5
26956,Learn Guitar in 21 Days,2.5
648118,JavaScript Rockstar How to create Incredible Useful code,2.5
1112844,The Complete Web Developer Masterclass: Beginner To Advanced,2.5
519968,Expert Guide : Mastering Types feature in illustrator !,2.5
252396,How to Pick The Right Penny Stocks To Invest In 2017,2.5
310652,How To Sell Practically Anything: Professional Design Mockup,2.5
212492,Aprende a tocar blues en el piano y teclado,2.5
814068,Get Acquired: Learn From The Head Of Acquisitions For eBay,2.5
403100,"Trading Stock Chart Patterns For Immediate, Explosive Gains",2.5
388286,CoffeeScript: The Good Parts—Write Better javaScript,2.5
939668,Learn 3 - All Time A R Rahman Hits on Carnatic Flute!,2.5
901082,"Digital Art in Adobe Illustrator CC: Angry Bird, Tom & Jerry",2.5
317030,Learn how to double your Forex Trading Account in one trade,2.5
1201118,Icon Design Masterclass: Learn Icon Design Principles,2.5
674354,Invest Like a Pro!,2.5
985104,Investimento em Ações para Leigos,2.5
344224,Java Spring Security,2.5
895096,Ultimate JavaScript Objects,2.5
838260,Forex trading Basic to advance Professional Level course,2.5
433084,DIY Beautiful Social Graphics That Don't Require Photoshop,2.5
138004,Accounting Concepts For Technocrats,2.5
398456,Bootstrap 3 Introduction : Create RESPONSIVE Websites Fast,2.5
637922,Venture Capital. What is it and Why it Matters to You!,2.5
656914,Cartoon Game Logo Design using Photoshop,2.5
188584,Letras en Adobe Illustrator,2.5
101498,Blues Guitar Lessons - From Texas To Carolina,2.5
820086,Bass Guitar Lessons For Beginners,2.5
724436,Guitarra Acústica en Siete Días,2.5
1031780,Ready for Production with Spring Boot Actuator,2.5
463354,Editorial Illustration Tutorial: From Drawing to Photoshop,2.5
333046,The Ultimate Method for Learning Modern Piano & Keyboards,2.5
100916,Blues Guitar Lessons - Blues Guitar - Robert Johnson,2.5
473338,Wordpress Security,2.5
155640,Building a Search Engine in PHP & MySQL,2.5
313512,Financial Reporting - Fundamentals/Basics,2.5
269638,Codeigniter: How to use Codeigniter that drives knowledge,3.0
325834,Learn to Trade for Profit: Find and Trade Winning Stocks,3.0
799912,Alto Saxophone Lessons For Beginners,3.0
945336,Javascript Intermediate level 1 - Mastering the DOM,3.0
312860,"IAS 16-Property,Plant and Equipment ",3.0
808808,Introduction to GIMP 2.8: Tutorials for Beginners,3.0
1037868,Digital Pianist Course-Learn Piano & Keyboard Fast & Easy,3.0
393850,Creación de iconos con Illustrator,3.0
43441,"Master 'Technical Analysis and Chart reading skills Bundle""",3.0
323196,Master Finance in Three Hours,3.0
720072,Hands On Guitar: Beyond Beginner,3.0
64078,iPhone icons in iOS7 - learn flat design,3.0
128384,Big Data and Apache Hadoop for Developers - Fundamentals,3.0
829182,【個人事業主向け】青色申告の記帳を自力で行うための複式簿記の基本,3.0
628798,"Learn Piano with Beyer, 15 Minutes Challenge",3.0
607360,Learn Oud 2,3.0
765916,Start Web Development with GIS Map in JavaScript,3.0
389018,How to Create a Wordpress Website from Scratch - No Coding,3.0
1182330,Learn Logo Designing: 5 Types of Logo Designs in Illustrator,3.0
1110756,HTML Tutorials : HTML Code for Website Creating,3.0
761768,"Create Complete Sign up System using PHP, jQuery and Ajax",3.0
658276,Piano for Singer/Songwriters | Write Songs and Perform Live!,3.0
211026,Aprende a tocar Jazz y Ritmos Latinos en la guitarra,3.0
123566,Learning Bootstrap 3 - Tutorial From Infinite Skills,3.0
960898,Photoshop CC 2017 for Beginners: Master Photoshop Essentials,3.0
576722,Simple And Easy: Wordpress For Beginners,3.0
573064,Photoshop in Ease: Create World Amazing  Graphic Designs,3.0
818838,Trombone Lessons For Beginners,3.0
1070886,Python Algo Trading: FX Trading with Oanda,3.0
1097486,Apprendre à trader sur le marché du Forex - guide complet,3.0
499904,Create full featured Landing Page in Ruby on Rails in 3 hour,3.0
660846,Five steps to becoming a winner in stock investing,3.0
1163894,Build a Chatbot integrated Website using Bootstrap 4,3.0
398522,Learn the Violin - Scales and Fundamentals,3.0
1065198,GUITAR #1: Beginner Basics and Beyond,3.0
554136,Building Responsive Websites with Bootstrap 3 Framework,3.0
136244,Triple P Trading Course,3.0
986742,Learn OAuth 2.0 - Theory and Hands On,3.0
445916,Excel Dashboard - Interactive Excel Dashboard and Charts,3.0
763100,Guitar Lessons - 50 Essential Fast Legato Licks,3.0
1073793,Start Writing JavaScript Today - Beginner JavaScript Course,3.0
392478,Startup Business: How To Raise Seed Capital,3.0
659340,Pic Monkey for Beginners - Graphic Design and Photo Editing,3.0
525034,Kali Linux Web App Testing,3.0
471428,Crash Course on Cost of Capital and Capital Structuring,3.0
288256,"Trade Stocks, Forex & Financial Markets like a Professional",3.0
646906,Playing Piano:  Play Chords and Popular Pieces Vol.I,3.0
576646,Create Fast RESTful APIs with Lumen and Homestead by Laravel,3.0
311916,Create a Responsive Website with Bootstrap 3,3.0
80844,Beginner Guitar - 38 Easy Lessons You Needs to Get Started,3.0
27681,Piano Improvisation from Day One,3.0
1198302,Traditional-Style Electric Blues Guitar For Beginners,3.0
737182,Estrategias de Inversión aplicadas al mundo del trading,3.0
144222,"YOU can Draw, Shade and Paint a Mixed Media Girl...today!",3.0
733654,なぞるだけですぐできる! 簡単手描きイラスト講座,3.0
429364,Master the Basics of HTML5 & CSS3: Beginner Web Development,3.0
708514,Mastering TypeScript,3.0
218856,Aprende a tocar la flauta dulce de forma sencilla y gradual,3.0
802038,Bluegrass Guitar Essentials: Webisodes 5 & 6,3.0
1165268,15  Motion Graphic Elements in After Effect (Series 2),3.0
963412,Building Websites JavaScript and the DOM,3.0
206986,Piano Lessons for Beginners Made Easy,3.0
1030774,Master all PHP ideas 2017 to build any project,3.0
498360,Trading For Busy People,3.0
618586,"Flute Solos: Learn how to Perform Three Fun, Unique Pieces",3.0
893056,Didgeridoo - from zero to HERO! Part One - beginning,3.0
806122,Learn and Master the Basics of Finance,3.0
1276020,Photoshop para iniciante - o básico,3.0
180360,Equity Swaps,3.0
970880,"Blues Guitar Lessons for Beginners: Chords, Rhythm and Lead",3.0
173548,Build Your First Website in 1 Week with HTML5 and CSS3,3.0
812798,Value Investing and Stock Market Fundamentals,3.0
46933,Business Accounts For Managers,3.0
615084,Laravel(5.2) PHP Framework  Jump Start for beginners,3.0
1053406,Java Web Services Part 2,3.0
533416,Build Powerful Websites & Blogs using WordPress - No Coding,3.0
725906,Piano Lessons For Beginners: Learn Piano Quickly And Easily,3.0
746366,Financial Statements: Learn Accounting. Unlock the Numbers.,3.0
207408,Aprende a tocar la guitarra acústica como un profesional,3.0
1100628,Canva: Design and Sell Your Own Professional Canva Designs,3.0
850726,Forex trading with binary options,3.0
611518,Learn ASP NET MVC 5 step by step,3.0
544176,Trading strategies with common sense technical analysis,3.0
1253868,Complete Short Financial Ratio Course for Financial Analysis,3.0
1113702,"Intro. to Asset-Backed Securities, CFA Level I,  2017 Prep",3.0
41145,Learn Call Options and Put Options - Introduction to Options,3.0
79120,LaTeX for Professional Publications,3.0
473160,Web Design for Web Developers: Build Beautiful Websites!,3.0
602812,"Music Theory, Guitar and Ear Training",3.0
852426,Curso de Guitarra para Principiantes,3.0
1027016,Complete Codeigniter: From Beginner to Advanced,3.0
783686,Byte-Sized-Chunks: Dynamic Prototypes in Javascript,3.0
482334,Fingerpicking for Guitar,3.0
825752,Angular 2 - Superheroic Framework,3.0
1199774,JavaScript 2017: Become Top Rated Web Developer,3.0
862428,PHP : Learn to upload files to Amazon S3 and use CloudFront,3.0
640100,Accounting & Financial Statement Analysis: Complete Training,3.0
1148342,Step by Step Build Your Template by Bootstrap 4 from scratch,3.0
568524,WordPress Plugins Treasure Chest,3.0
428220,How To Make Professional eBook Covers For FREE,3.0
342398,Learn the Violin - No Music Experience Necessary!,3.0
476408,"Learn HTML, A practical guide from scratch to HTML 5",3.0
180384,Yield Curve Dynamics,3.0
162274,Joomla 3 - The Basics,3.0
1079624,HTML and CSS for Absolute Beginners,3.0
1266306,Forex Trading: Your Complete Guide to Get Started Like a Pro,3.0
714724,Docker Technologies for DevOps and Developers,3.0
125806,Comprehensive JavaScript Programming,3.0
1146166,LaTeX A-Z: from beginner to advance in less than 3 hour,3.0
606494,The 80/20 Beginner Guitar Course,3.0
1105344,Quantitative Aptitude for Banking & Competitive Examinations,3.0
212398,Advanced Node.js Development,3.0
1210588,Beginner to Pro - Financial Analysis in Excel 2017,3.0
149728,Learn Jazz Piano Today,3.0
1228900,Learn Professional Book-Cover Designing Photoshop 4 Beginner,3.0
597716,Trade Pullback Candlestick Strategy - Make Consistent Pips,3.0
714188,"Fixed Income Valuation and Analysis, CFA L2",3.0
1173716,Arpeggios for Guitar made Easy! Dominate the Fretboard,3.0
1165780,Ratio analysis for bankers and credit analysts,3.0
716828,The Beginner's Guide to the Futures and Options Trading,3.0
219844,Aprende a tocar el clarinete.  ,3.0
1220862,"The True ' Secret Sauce  For Stock Market Success""",3.0
741316,Piano With Willie: Jazz Kids - Vol 2,3.0
41961,"Options Foundation - Time Decay, Implied Volatility, Greeks",3.0
280194,"Become a Graphic Designer, and earn a living from it",3.0
528784,Stock market Investing Encyclopedia: How to invest in stocks,3.0
1176686,Mastering Basic CSS Selectors.,3.0
867440,"Bitcoin: el futuro del dinero, hoy",3.0
832514,Acoustic Guitar Lessons For Beginners,3.0
1030976,The Complete Financial Statement Analysis Course,3.0
597868,こどもギターレッスン　リトルギタリストⅠ,3.0
718426,Create a Dynamic User Registration Form from scratch,3.0
79364,Your Business by the Numbers,3.0
308694,"Forex Strategies: Kelly Criterion, Larry Williams and more!",3.0
899534,Learn Redis from Scratch,3.0
628356,Learn Web Animation the Easy Way: An Intro to SVG and GSAP,3.0
294914,Debt Collection Management: Get Paid On Time EVERY TIME!,3.0
708558,Learn HTML Basics From Scratch,3.0
179978,How to Make IT Work Successfully in Capital Markets,3.0
12214,Back 2 The Basics,3.0
1172370,Mit Finanzwissen zu besserem Unternehmertum,3.0
218596,Aprende a tocar la trompeta,3.0
42040,Buying Call and Put Options - Options beginner strategies,3.0
966268,Digital Asset Designer: Creating and Selling Mockups,3.0
54677,Revealed: Profitable Principles of Successful Traders ,3.0
47004,Photoshop Course: Design an eBook Cover in Photoshop,3.0
214218,"Aprende a tocar jazz, salsa y blues en el piano",3.0
1198654,How to set up a Web Server From Scratch to One Fully Managed,3.0
16151,AJAX Development,3.0
219756,Aprende a tocar flauta transversal sin complicaciones,3.0
637402,Drawing in Perspective,3.0
741388,Piano With Willie: Jazz Kids - Vol 3,3.0
757284,Slide Guitar- Slide Soloing Essentials,3.0
1104858,Photoshop Tools 101,3.0
273256,Mind-Blowing Photoshop: Master Skills Season 1,3.0
830834,Quick learning jQuery web development,3.0
220604,Pixelmator - Create Vector Graphics From Scratch,3.0
543346,ReactJS Course: Learn JavaScript Library Used by Facebook&IG,3.0
1218130,React VR - Creating Virtual Reality Apps,3.0
708578,Bootstrap 4 Quick Start: Code Modern Responsive Websites,3.0
760306,Learn JavaScript Dynamic Interactive Projects for Beginners,3.0
390510,Tax made simple for Limited Company Owners and Contractors,3.0
625974,Total beginner to intermediate guitar - Learn to play by ear,3.0
945750,Fundamentals of Accounting,3.0
331600,Learn Bookkeeping From Scratch,3.0
218658,Aprende cómo tocar el Bajo Sexto,3.0
1270392,"The Complete JavaScript, HTML and CSS Tutorial For Beginners",3.0
399170,Small Business Owners: Drive a Productive Business and Grow,3.0
322332,Learn To Invest In 7 Steps,3.0
343816,Learn SASS and improve your CSS,3.0
574876,Get started Creating Websites Everything you need provided,3.0
317572,Accounting 1 Simplified for You,3.0
555952,Learn UI/UX and Mobile App Design in Photoshop from Scratch,3.0
421018,Learning Object-Oriented JavaScript,3.0
1101522,Cajon Step-by-Step: Beginner > Intermediate > Advanced,3.0
771880,Clarinet Lessons For Beginners,3.0
452684,jQuery for Beginners - Create Website Animations Easily,3.0
